,index,Tweet,HS,Abusive,HS_Individual,HS_Group,HS_Religion,HS_Race,HS_Physical,HS_Gender,HS_Other
714,11867,"USER Baru mantap, rejeki bekah buat keluarga.\nDaripada cari sampingan jilat2 penguasa jilat2 pantat penista agama'",1,1,1,0,0,0,0,0,1
715,8877,"Semua bentuknya adalah problem2 populer remaja/cinta monyet, tapi tidak hiperbola.\nPopuler artinya semua orang merasakan. Trouble-nya universal. Masalah orang ketiga, komunikasi, dan sejenisnya.\nMemang orang Indonesia suka terbawa perasaan. Tipikal.'",0,0,0,0,0,0,0,0,0
716,3093,"USER USER USER USER USER USER USER USER Klu jaman pak Harto anak"" berprestasi di perhatikan....\nKlu jaman Rezim skrg yg Lebay yg di panggil ke istana....\nRezim aneh....\n#2019GantiPresiden'",1,0,1,0,0,0,0,0,1
717,6483,"USER Saya Kristen. Kalau seandainya PAK AHOK MAU MASUK ISLAM, AKU SETUJU. kalau cuma identitas KTP atau Administrasi tertulis agama Islam, terserah deh tapi di hati/batin isinya apa siapa yg tahu. KALAU PAK AHOK AGAMA ISLAM, BELIAU BISA MASUK KE POL",0,0,0,0,0,0,0,0,0
718,9426,"USER USER Hahahaha terus ko pikir lo pinter gitu? Berak sekebon! Ngakak dah, sok iya banget padahal goblok dari awal. Kebanyakan makan taik ahok lu. Pake ngeles sana sini lagi dasar cebong kapir intoleran sara munafik goblok hahahaha'",1,1,1,0,1,0,0,0,0
719,12899,USER Banyak sampah emang:(',0,0,0,0,0,0,0,0,0
720,11506,"USER Hyunjin anak tunggal, i.n pny abang &amp; adik. Mereka berdua sama2 katolik. Sekolah di SOPA. Hyunjin dance line, i.n vokal line'",0,0,0,0,0,0,0,0,0
721,11562,"â??Yang menyebabkan agama cacat adalah hawa nafsu, maka kendalikanlah hawa nafsumu.â?? (HR. Asyahaab)",0,0,0,0,0,0,0,0,0
722,8148,USER Men are trash lol. Jap daler tu pahal ckp cm org cacat.',1,1,1,0,0,0,1,0,0
723,2376,USER Waktu nya ngewe',0,1,0,0,0,0,0,0,0
724,12771,USER USER Iyaa hyung itu si ibu kunti wkwk',0,0,0,0,0,0,0,0,0
725,7280,USER USER Bala bantuan cebong dateng..\xf0\x9f\x98\x82\xf0\x9f\x98\x82',0,1,0,0,0,0,0,0,0
726,628,RT USER USER Prabowo simulut busuk Rizieq anies Fadlizon Fahri mereka kumpulan sampah negara jd kelakuan mereka juga kaya sampah,1,1,1,0,0,0,0,0,1
727,6145,"Islam dijadikan fitnah terorisme dan radikalisme. Jauh sebelum kata itu dibuat, Islam dan Indonesia baik baik saja.\n\nKemungkinan besar ini terorisme terjadi karena peran elite global yang ingin menjatuhkan dan menghancurkan melalui serangkaian drama ya",0,0,0,0,0,0,0,0,0
728,7341,RT USER UsirDubesMyanmar,1,0,1,0,0,1,0,0,0
729,10141,"Gua heran ama USER; Dan sebagian warga dki.. ; ; Pilkada ribut dengan mayat.. ; Jadi gubernur ribut sama mayat.. ; ; Lama"" nyalahin Allah yg nentuin takdir.. ; TOLOL kok d isi ulang??; ;",1,1,0,1,0,0,0,0,1
730,12728,"Duduk di samping adalah Aziz Rabbah, Menteri Energi, Pertambangan dan Perminyakan Kerajaan Maroko. Diskusi substantif, berjejaring dan mencari peluang kerjasama justru biasanya muncul di sela-sela konferensi.;",0,0,0,0,0,0,0,0,0
731,1561,USER USER USER USER Kok baju item disalahin? Bisa jadi itu 2 korban yg nyuruh dia buat dorong atau malah Orang2 tua di situ yg suruh dorong. Ga perlu dikatain bangsad juga bocah yg dorong karena blm tentu murni kesalahan dia.',0,1,0,0,0,0,0,0,0
732,10938,eng ing eng ...; ; KPK Periksa Gubernur dan Cawagub Sumut Ijeck Shah,0,0,0,0,0,0,0,0,0
733,10261,Lengkap sudah julukan untuk KPK. Mulai dari antek Yahudi sampai Komunis. Hahaha.. Bubarkan Semen Padang FC!!,1,0,0,1,0,0,0,0,1
734,12243,"USER USER USER USER USER USER USER USER USER USER BACOT LU WAN, KAGA ADA YG NYARIIN LU YAKIN DAH'",1,1,1,0,0,0,0,0,1
735,12632,USER USER USER USER USER USER USER USER USER USER USER USER USER USER USER USER USER USER USER USER USER USER,0,0,0,0,0,0,0,0,0
736,8885,Turunkan jokowi! jokowi kader PKI terselubung boneka sekjen PKC! kok ada wacana aneh dan bahayakan kedaulatan negara begini rezim saat ini?,1,0,1,0,0,0,0,0,1
737,11758,USER Kenapa org baik selalu dikasih cobaan dengan berhub sama org yg brengsek?\xf0\x9f\x98\x82',0,1,0,0,0,0,0,0,0
738,9396,USER USER indonesia mau bangun hambalang diteror..reklamasi oleh cina dan meikarta lancar dan aman,1,0,1,0,0,1,0,0,0
739,10603,"USER Kejadian 98, sgt menyedihkan.. ada beberapa warga Tionghoa yg sdh 28 thn menetap dan berbaur di kampung saya, pdhl kami org KP, sdh berusaha melindungi\xe2\x80\x8b mereka, ehh kejadian 98 mereka lari terbirit-birit meninggal rumah dan temp",0,0,0,0,0,0,0,0,0
740,4650,Masa sih sampe segitunya ma hestek?,0,0,0,0,0,0,0,0,0
741,5277,USER USER Jokowi diktator muka ndeso hehehe,1,1,1,0,0,0,1,0,0
742,10249,"Teramat byk alasan untuk saling menghimpit itu, penguasaan materi berselubung agama, nasionalisme, ideologi, partai politik, warna kulit. Dada kita sesak oleh asap bom. Mata kita terhalangi oleh pekat debu. Pandangan terbentur oleh kaca dan tembok. Kita",0,0,0,0,0,0,0,0,0
743,11265,Apakah ini HOAX?? colek USER USER USER,0,0,0,0,0,0,0,0,0
744,1607,USER USER zonkey hanyalah seekor banci planga plongo...',1,1,1,0,0,0,0,1,0
745,11163,tau kenapa kalo anda bicara tumpas PKI komunis dan antek pasti anda akan diserang ya krn yg serang anda itulah PKi cm pki yg lindungi pki,1,0,1,0,0,1,0,0,0
746,793,"USER Sungguh""rezim KOPLAK..indonesia sedang sekarat..umat muslim sdg di pilah""oleh Allah SWT..antara golongan muslimin dan munafiqun.",1,0,0,1,1,0,0,0,0
747,8978,RT USER: twitteran mulu pantesan goblok.',1,1,1,0,0,0,0,0,1
748,7318,"Dulu USER dizalimi kroni-kroninya megawati keluar jd pemenang,sekarang dizalimi kroni-kroninya USER daur ulang sejarah USER",1,0,1,0,0,0,0,0,1
749,288,USER USER USER USER USER USER USER USER USER USER USER USER USER USER USER USER USER USER USER USER @,1,1,0,1,0,0,0,0,1
750,9513,USER trus jualannya di FKL gitu. ngamfrak... hahha bani kamfret logikanya kacau.',1,1,0,1,0,0,0,0,1
751,4523,Gubernur DKI Shalat Jumat BersamaÂ Erdogan,0,0,0,0,0,0,0,0,0
752,6701,USER jancuk',0,1,0,0,0,0,0,0,0
753,6767,"RT USER: bocah SMP jaman now,, colmek sampe becek \n\n#bahancoli #memek #colmek #colokmemek #jembut #memekbecek URL",0,1,0,0,0,0,0,0,0
754,9342,"USER jing ccd org2 kek gitu disuruh pegang gangang badminton aja paling dijadiin maenan gitar, belagak bgt elah'",1,1,0,1,0,0,0,0,1
755,3924,"USER USER USER Sarap nih orang! Udh Salah, Bego Bukanya malu'",1,1,1,0,0,0,0,0,1
756,294,RT USER USER USER USER USER USER USER Haha kalah ni yee org jahat pasti kalah,1,0,1,0,0,0,0,0,1
757,11781,RT USER Berarti BPK sama DPR gak dapat dipercaya dunk. Jadi lebih baik bubarkan saja.,1,0,0,1,0,0,0,0,1
758,1301,"Dulu para pahlawan berjuang susah payah, korban jiwa raga utk usir penjajah. Eh..skrg koq kita biarkan negeri ini dijajah cina dgn mudahnya ?!",1,0,0,1,0,1,0,0,0
759,5423,bgst masih aja ngomongin titit',0,1,0,0,0,0,0,0,0
760,11979,Mari kita ganyang pki dari NKRI..,1,0,0,1,0,0,0,0,1
761,9367,"Ekonomi; salah satu ilmu sosial yang mempelajari aktivitas manusia yang berhubungan dengan produksi, distribusi, dan konsumsi terhadap barang dan jasa.",0,0,0,0,0,0,0,0,0
762,7050,USER Alay tai kyk bocah sd lol',1,1,1,0,0,0,0,0,1
763,3046,"USER kacrut , rank 10 tapi mainnya gk cerdas asal gebuk doang'",1,1,1,0,0,0,0,0,1
764,10450,USER USER buseeet nuzuuuk bangeet ke MALING DUIT si ZUMI jhiahaha alumi 212 pikiran cuma gimana jadi maling bisa kasih makan onta NASBUNG kalau lagi demoooo kwkwkwkw',1,1,1,0,0,0,0,0,1
765,6941,USER Intinya PKS mesti salah.\nWalau benerpun harus salah...\nItu otak cebong.\nMakanya kita ttp #2019GantiPresiden',1,1,0,1,0,0,0,0,1
766,5001,"Berkebalikan dengan semangat UUPA 1960, orientasi politik #agraria rejim Orde Baru adalah untuk mendukung investasi-investasi skala besar. |#keadilandistribusitanah'",0,0,0,0,0,0,0,0,0
767,8819,"Direktur Riset Median, Sudarto mengatakan, meski Jokowi masih menduduki posisi teratas, ? NAMUN MAYORITAS WARGA TAK INGIN DIA MEMIMPIN INDONESIA KEMBALI ?; ; Pinjem TOA donkz ?; ; #2019GantiPresiden MUTLAK !!!!; ;",1,0,1,0,0,0,0,0,1
768,6523,"USER Kristen nusantara juga ada, ada gerejanya malah GKJ (Gereja Kristen Jawa)'",0,0,0,0,0,0,0,0,0
769,4387,"USER \xe2\xa0\x80\xe2\xa0\x80\xe2\xa0\x80\xe2\x80\x9dOh\xe3\x83\xbc!\xe2\x80\x9d Melirik ke kirinya. Dia melihat sosok yang tak asing baginya itu. Tetapi, dia kebingungan dalam mengingat sosok itu. \n\xe2\xa0\x80\xe2\xa0\x80\xe2\xa0\x80\xe2\x80\x9",0,0,0,0,0,0,0,0,0
770,11689,RT USER USER USER Min apa benar ini orang kerja di kantor pajak? Kalau iya memalukan sekali KaPolri,1,0,1,0,0,0,0,0,1
771,10960,USER Siklus couple-an\n\n- beda rasa\n- rasa asing\n- break\n- break up\n\nDah gitu aja terus...\n\nKalau merasa tak sama seperti dulu coba saling terbuka. Itu biasa nya krn ada nya kurang komunikasi atau ketidak pekaan di satu pihak \xf0\x9f\x98\x85,0,0,0,0,0,0,0,0,0
772,7866,USER USER Ngelancarin bahasa inggris ajadeh uwu aku udah pernah belajar bahasa asing yg selain inggris gaada yg nyantol sekarang wkwkw soalnya jarang dipake kan ya',0,0,0,0,0,0,0,0,0
773,437,"Yailaah giliran gini aja pada rame yg ngebela\nDulu pas idol mati, cuma sedih doang malah diserbu gila2an\nYang sarap siapa ya maap?'",0,1,0,0,0,0,0,0,0
774,299,"2,Orang-orang (Yahudi dan Nasrani) yang telah Kami beri Al Kitab (Taurat dan Injil) mengenal Muhammad'",0,0,0,0,0,0,0,0,0
775,12887,"Seharusnya Tersangka Setya Novanto yg kena sanksi pecat, itu baru top!",1,0,1,0,0,0,0,0,1
776,10112,"Betul itu kang ! Lengserkan jokowi, dari awal kerja nya cuma pikir infrastruktur, bkn pikir rakyat ini bisa nyaman dengan ekonomi yg stabil.",1,0,1,0,0,0,0,0,1
777,3082,"Apakah Anda jujur, percaya Allah SWT perintahkan penggal kafir adalah Tuhan, Pak Lukman?",1,0,0,1,1,0,0,0,0
778,8053,Nama: Indra J Piliang Status: Terperiksa Kasus: Penggunaan Narkotika (diduga) Mendukung Anies-Sandi,1,0,1,0,0,0,0,0,1
779,10944,USER USER USER USER USER USER Utang meroket \nRupiah anjlok\nEkonomi nyungsep\nInfrstruktur Ambruk\nBBM naik\nDaya beli turun\nDiserbu Import ratusan ton narkoba \nDiserbu TKA\nDuit 35 trilyun digondol taipan\n.,1,0,1,0,0,0,0,0,1
780,972,"USER USER USER USER USER USER Ngoaaahahaaa saking kejang kejang nya si bani kuda wowok bin onta, sampai ga baca tulisan gue ..... ibu kau msh selingkuh dgn kuda wowok tuh.... ngoaaahahaaaa \xf0\x9f\xa4\xa3\xf0\x9f\xa4\xa",1,1,0,1,0,0,0,0,1
781,9374,"USER Bloon lebih bawah dari bodoh, di bawah bloon ada goblok'",0,0,0,0,0,0,0,0,0
782,1350,"Keandra adalah sosok lelaki yang tertarik dengan kedua jenis gender, dan juga mengakui keberadaan transgender. Dia menganggap dirinya sebagai lelaki, tapi dia juga beranggapan bahwa norma gender itu tidak ada, sehingga ia sering bertingkah laku layaknya",0,0,0,0,0,0,0,0,0
783,1180,USER USER Ya..ttp aj waspada..!!Antek komunis itu pintr kamuflase..,1,0,0,1,0,1,0,0,0
784,5243,"Lagi belajar desain, terus hasilnya di cacat terus sama wn. Rasanya duh kayak naik rollercoaster ~\n\xf0\x9f\xa4\x90'",0,0,0,0,0,0,0,0,0
785,6794,"USER Status ""kafir"" kan relatif, tergantung ditinjau dari sudut yg mana... Santai saja'",0,0,0,0,0,0,0,0,0
786,10573,Cc. USER ; Miss ann USER ; Mosok yg punya partai kalah sama yg ga ada partainya? :-); Ajak follower mu yg ribuan..,1,0,1,0,0,0,0,0,1
787,727,USER USER \xc2\xab diem lu buaya.',0,1,0,0,0,0,0,0,0
788,12979,"THR GAJI TIGEBELAS HEBOH MACAM IKLAN, (SOPOI LOK) SEKALI BBM NAEK SENYAP HAMPIR TAK KEDENGARAN TANPA SUARA\n\nINGAT.... AMBIL UANG NYA, GANTI PRESIDEN NYA \xf0\x9f\x98\x81\xf0\x9f\x98\x81\xf0\x9f\x98\x81\n\n#2019 GANTI PRESIDENT'",1,0,1,0,0,0,0,0,1
789,411,"Presiden Aspek Indonesia Mbak USER :; Kami tidak Anti Investasi Asing; Tapi , apabila berubah jadi Invasi Asing, sudah kewajiban KITA sebagai Warga Negara utk melawannya",0,0,0,0,0,0,0,0,0
790,725,"#TolakPerpresTKA; #TolakPerpresTKA; #2019GantiPresiden; #2019PresidenBaru; ; Hai mahasiswa Indonesia, nih ada hadiah lipstik dan kolor untuk kalian dari seorang kakek tukang beca",1,0,0,1,0,0,0,0,1
791,832,Adaloh orang yang suka nyinyirin pecun di timeline tapi ngelike postingan akun open BO. \xe2\x98\xba',0,0,0,0,0,0,0,0,0
792,2630,"12. Di awal sambutannya, Presiden USER menyampaikan apresiasinya dapat bertemu dengan para kader PMII yang diyakini memiliki semangat tinggi sebagai pemuda muslim Tanah Air #JokowiAjakMasyarakatOptimistis",0,0,0,0,0,0,0,0,0
793,8021,USER USER Memang benar!!! Kami ingin ganti!! Mudah2n ekonomi makin membaik gk sesulit sekarang!!!,1,0,1,0,0,0,0,0,1
794,9525,"Hasan Al-Bashri brkata: Mereka (para ulama) brkata: ""Akhlak kaum mukminin yg paling utama adalah m'beri maaf."" (Az-zuhud, Imam Ahmad:1/287)",0,0,0,0,0,0,0,0,0
795,7682,"USER USER USER dicap radikal tentu ada buktinya, seperti ormas yg terang terangan mendukung isis, atau melabeli umat dan ulama yg berbeda pendapat kafir dan munafik'",0,0,0,0,0,0,0,0,0
796,9672,USER USER Aturan sebut salah satu yak. Biar yg lapor satu agama aja. Lah ini ga nyebut. Yg kesinggung ada 5 agama,0,0,0,0,0,0,0,0,0
797,11989,USER Rezim represif anti Islam.,1,0,1,0,1,0,0,0,0
798,171,"Foto memang bisu ,tpi memiliki banyak arti yg sush diartikan,sma seperti kamu susah diartikan,mau putus atau lanjut ?'",0,0,0,0,0,0,0,0,0
799,12896,USER LEBIH SATRIA ANIES SANDI MUNDUR,1,0,1,0,0,0,0,0,1
800,1008,"RT USER: Seekor monyet yang berada di Kebun Binatang Tianjin, Cina menjadi viral karena memiliki wajah seperti manusia. Monyet berus\xe2\x80\xa6'",0,0,0,0,0,0,0,0,0
801,3289,"Dalam sambutannya, Ketua DPD Golkar Lumajang Sudjatmiko menyampaikan bahwa keputusan partai yang menetapkan Kofifah indar Parawansa sebagai calon gubernur dan Emil Elestianto Dardak sebagai calon wakil gubernur Jatim dari Partai Golkar sudah bulat. #Khofif",0,0,0,0,0,0,0,0,0
802,3347,Bubarkan KPK perkuat lemabaga negara sistem politik,1,0,0,1,0,0,0,0,1
803,688,USER Alah kntl',1,1,1,0,0,0,0,1,0
804,2009,Wahai umat bersatu jangan peduljkan mereka membelot ke Jkw itu petunjuk Allah bahwa is tdk Amanah &amp; demi uang/jabatan/ kasus.Maju USIR Aseng',0,0,0,0,0,0,0,0,0
805,2290,"USER USER USER Coba aja pak USER punya sifat keras seperti endorgan sedikit saja, mungkin mereka yang nuduh PKI itu udah masuk Lapas kali ya,; Salut sama bapak presiden kita USER sabarnya tingkat dewa; Maju terus pak ; #2019TetapJokow",0,0,0,0,0,0,0,0,0
806,9014,Makin jelas rezim ini anti ISLAM..!! URL,1,0,1,0,1,0,0,0,0
807,4828,"I like to read this kind of emotion discharged. You dont have to insult, dont have to use bad words, no need to be harsh. ; ; Kita melayu, beradab. Ikutlah budaya kita.; ; **kecuali penulis blog cinta sendu tak kesampaian mak nangis keluar anak mata.",0,0,0,0,0,0,0,0,0
808,9512,Pekerja CiNA Proyek Jalan TOL Lempar Bendera Merah Putih CUMA dihukum HORMAT BENDERA &amp; Di DEPORTASI LAHH,1,0,0,1,0,1,0,0,0
809,7338,"menurut gue theist agnostic ini boss gue, dia islam turunan ayahnya, but doi nikah sama cewek katolik, ibunya katolik, mereka puasa etc tapi ga solat. why? mereka bukan males ibadah sih mereka punya paham sendiri tentang tuhan, ya situ mah kalo mang male",0,0,0,0,0,0,0,0,0
810,11478,Pertemuan Presiden Jokowi dan Ulama Jawa Barat. USER,0,0,0,0,0,0,0,0,0
811,8309,Trio Provokator: Wiwo Amun Raiso &amp; Sotipu URL USER USER USER USER USER,1,0,0,1,0,0,0,0,1
812,3107,"Dibalik Insiden Heli Jatuh, PT IMIP Pekerjakan 3.000 WN China",0,0,0,0,0,0,0,0,0
813,2893,"Kmana Paduka ktika ulama Jabar diserang, bhkn ada yg meninggal?; Adakah sepata dua pata kata terucap saat itu?; #hey2;",0,0,0,0,0,0,0,0,0
814,12408,USER DM(di memek)maksudnya ndok',0,1,0,0,0,0,0,0,0
815,5439,"Pusat Tahfiz perlu ditingkatkan, dikawalselia, dan diperkasakan ... bukan ditutup. \n\nBegitulah juga halnya dengan sekolah-sekolah Cina dan Tamil.'",0,0,0,0,0,0,0,0,0
816,2857,USER Gerombolan bani kampret',1,1,0,1,0,0,0,0,1
817,7410,"USER Beliau hebat,,di rezim beliau lah Kroasia lolos ke final piala dunia mengalahkan inggris dg skor rp 14500 : 1 $...kerja kerja kerja...'",0,0,0,0,0,0,0,0,0
818,10622,"USER USER itu yang menuduh gak konsisten amat sih. Satu hari menuduh Gus USER liberal, hari lain komunis.\xf0\x9f\x98\x92'",0,0,0,0,0,0,0,0,0
819,3226,USER Enak buat gesek2 memek \xf0\x9f\x98\xb3',0,1,0,0,0,0,0,0,0
820,13059,"USER Mungkin analoginya kyk pancasila min, apa ada pancasila protestan? Pancasila katolik? Pancasila budha? Pancasila islam? Pancasila Hindu? Pancasila Yg niat awalnya mempersatukan tanpa memandang stereotip agama, malah dikotak-kotak lg deng",0,0,0,0,0,0,0,0,0
821,11289,"USER Saya suka Anies kasih kuliah, pasti bagus. Saya dukung Anies jadi dosen, prof, rektor. Itu memang kehebatan beliau. Bukan jadi gubernur",0,0,0,0,0,0,0,0,0
822,10684,"USER USER USER USER USER USER Pantes kaum kalian slalu bikin rusuh, sll doyan ngomong kotor, mudah dbodohi oleh pejabat kotor, karena cara menilai seseorang aja trnyata cuma dilihat dari gelarnya,",1,1,0,1,0,0,0,0,1
823,1306,"IHSG dibuka menguat 17,22 poin atau 0,28% ke 6.302,98.",0,0,0,0,0,0,0,0,0
824,1993,"Dalam PP baru itu, pemerintah menegaskan ketentuan bahwa pemegang Izin Usaha Pertambangan (IUP) dan Izin Usaha Pertambangan Khusus (IUPK) yang sahamnya dimiliki oleh asing untuk melakukan divestasi saham sampai 51 persen secara bertahap. #Freeport51'",0,0,0,0,0,0,0,0,0
825,10129,USER USER USER Memek itu nikmat ku suka....',0,1,0,0,0,0,0,0,0
826,12767,"orang-orang ini ajaib..yg makan duit siapa,yg nipu siapa, mau demo ke pemerintah..ujung-ujungnya dipolitisasi turunkan jokowi..haha. gila!!",1,0,1,0,0,0,0,0,1
827,6890,"USER USER Lah xl culun buh u,u'",1,1,0,1,0,0,0,0,1
828,8278,USER USER USER USER USER USER USER USER Klo kodok sma macan asia ya ga level laaah ....beda kelasss jauuuh....cma org2 dongoook dan dungu yg mengelu2kan kodok si munafik',1,1,0,1,0,0,0,0,1
829,2868,RT USER: Forever alone tahap Dewa Gila Babi member aku sorang ni URL,0,1,0,0,0,0,0,0,0
830,3204,Rakyat menolak KERAS!! Jika Indonesia dipimpin oleh komplotan MAFIA &amp; BAJINGAN ini! URL,1,1,0,1,0,0,0,0,1
831,245,KLHK Upayakan Pemerataan Ekonomi Melalui TORA di Kawasan Hutan dan Perhutanan Sosial - Tribun Medan,0,0,0,0,0,0,0,0,0
832,11932,USER Buat sewa jablay kayaknya jg bisa tuh',0,1,0,0,0,0,0,0,0
833,8280,Masalah dunia dan masalah nafsu ya kang USER . Kata2 kok bersayap kayak burung hantu. URL,1,0,1,0,0,0,0,0,1
834,9446,USER USER Bagus mana antara kilafah apa komunis',0,0,0,0,0,0,0,0,0
835,13122,USER USER Huehue si mahfud md udah ngikutin Geng si wowok dan oposisi tolol',1,1,0,1,0,0,0,0,1
836,11141,"USER Yang upload medianya cebong yang feeder cebong yang komen cebong, kapan loe jadi kodok klo loe cebong terus'",1,1,0,1,0,0,0,0,1
837,2379,"USER USER Padahal semua jaringan hidup ya pasti punya potensi jadi habitat cacinglah. Sapi, babi, manusia pun :)))'",0,0,0,0,0,0,0,0,0
838,9853,"USER anjir lucu banget animasinya :""D dewa'",0,1,0,0,0,0,0,0,0
839,12658,"USER Ente klo berani jgn Gk ada fotonya,jgn jd pecundang dan jadi antek2 kompeni? Nonton tuh bokep mulu ditwitter lo,pantes ancur indonesia.dasar otak mesum USER USER USER USER USER USER USER",1,1,1,0,0,0,0,1,0
840,8408,"USER USER USER USER USER USER USER Ohhhhh, kader moncong putih kan? Ciri khas cebong, pasti serang ke Islamnya.., coba yg ngelakui tapir psti MINGKEM'",1,1,0,1,0,0,0,0,1
841,1041,Takiyuddin tidak menjelaskan kerusi Parlimen mana yang bakal ditandingi oleh Abdul Hadi pada PRU14 ini.,0,0,0,0,0,0,0,0,0
842,6638,Semua salah jokowi. Hanya di rezim jahat diktator otoriter komunis kafir zalim inilah membuat opm sampai mulai... URL,1,0,1,0,1,1,0,0,0
843,1485,Presiden Jokowi: Saya Optimis Indonesia Semakin Cerah,0,0,0,0,0,0,0,0,0
844,10392,Insya Allah Presiden..aaamiinn,0,0,0,0,0,0,0,0,0
845,10780,USER USER okokok',0,0,0,0,0,0,0,0,0
846,12986,RT USER: \xe2\x9c\x8dinstagram:fanyaclarisha\n\xf0\x9f\x93\xb2wa+6281294490616\nUdah lama gk di entot sama brondong lokal. Enak jug entotanya\n\xf0\x9f\x91\x8ddont forget #r\xe2\x80\xa6',0,1,0,0,0,0,0,0,0
847,10357,USER Kan cuma lemparin mercon bukan bom -_-',0,0,0,0,0,0,0,0,0
848,12499,USER Sebagai netijen yg penasaran. Kalo abis eue kan ada tuh sesi pillow talk atau cuma ndusel2 lucu Ampe ketiduran. Paul Lo gitu gak sih ? Apa abis ena enak terus kaku lagi kek bh baru ?',0,1,0,0,0,0,0,0,0
849,12691,"USER Padahal petugas imigrasi luar negeri pada umumnya ya biasa aja. Mungkin di beberapa negara ada pemeriksaan mendalam karena dulunya memang paspor untuk tki, namun selama Kita punya bukti yg jelas sbg turis knp harus takut?\n\nKe Korea Selatan b",0,0,0,0,0,0,0,0,0
850,2732,KPK: 10 Anggota DPRD Sumut Kembalikan Uang - Warta Ekonomi,0,0,0,0,0,0,0,0,0
851,2987,Bodo ad sinyalnya eek gue donlot aja ntar',0,1,0,0,0,0,0,0,0
852,11395,RT USER USER Bubarkan aja dpr kerjanya santai ngantuk ngapain digaji wakil-wakil rakyat yg gak becus menyusahkan rakyat aja.,1,0,0,1,0,0,0,0,1
853,4648,"Buat orang yang duduk 5 deret sebelah kiri gue di C17, mungkin C20-C25, Planet Hollywood, Gatsu. \nKalian kampungan asli.\nKomen mulu sepanjang film.'",1,1,0,1,0,0,0,0,1
854,7672,USER USER USER USER Kasih tau sama si USER ah... Supaya jangan banyak cocot yang tidak berguna.',1,1,1,0,0,0,0,0,1
855,4524,"Jika kepatuhan terhadap TUHAN mu menjadikan dirimu keras kepala, menghakimi orang lain, Memfitnah , lalu Menghasut dan Menebar kebencian dengan mengatasnamakan AGAMA ...mungkin anda butuh cermin besar untuk menyadari apa yg sebenarnya kau sembah , TUHAN MU",0,0,0,0,0,0,0,0,0
856,9595,"\xf0\x9f\x91\xa6: ""Jangan jahatin anak orang""\n\xf0\x9f\x91\xa8: ""Baru juga sekali udah diginiin. Haha""\n\nEmang mau berapa kali lo jahatin anak orang, suparji........ mau sekali seribu kali juga lo jahat otong...sinting ya?'",1,1,1,0,0,0,1,0,0
857,7027,Lama lama perang sama cina atau usir cino dari bumi indonesia,1,0,0,1,0,1,0,0,0
858,7643,"...dan mereka akan semakin defisit. ; ; Mbok ora ndagel to min!! ; Uang dicetak dgn 2 sistem: ; 1. Pseduo Gold: pake cadangan emas (krn defisit, apa nda malah defisit?); 2. Uang fiat: jaminan asset. (Karena defisit, trs jaminan asetnya apa?) ; ; Jadinya ap",0,0,0,0,0,0,0,0,0
859,5492,"RT USER: prabowo subianto ketika menjadi ""aktor"" di TNI ketika 98 pun jabatannya adalah Pangkostrad. hampir saja berhasil ""kudeta""",1,0,1,0,0,0,0,0,1
860,6575,RT USER: ABG generasi micin udah hapal kalo gesekan kontol dimeki itu nikmat. URL,0,1,0,0,0,0,0,0,0
861,11028,banci anjr wkwkwk USER URL,0,1,0,0,0,0,0,0,0
862,5998,USER USER Tenggelamkan....itu bocah kepalanya korengan yg maha sombong selangit. Nangislaj kau keparat dlm wkt secepatnya',1,1,1,0,0,0,1,0,0
863,2920,USER USER Emang ada apa dengan onta?',0,0,0,0,0,0,0,0,0
864,8907,Narkoba yg paling berbahaya adalah ILUSI KESUCIAN AHOK SANG PENISTA.,1,1,1,0,0,0,0,0,1
865,10253,"Di Hadapan Ulama, Rommy Jelaskan Alasan PPP Dukung Jokowi'",0,0,0,0,0,0,0,0,0
866,9290,"RT USER: Suciwati Munir: ""Saya Enggak Percaya Sama Jokowi Bisanya Ngomong Doang."" URL URL",1,0,1,0,0,0,0,0,1
867,5057,USER Jd menurut pak ustadz mengenai yg rame d perbincangkan bgmna? Apakah RG trmasuk menista agama?,0,0,0,0,0,0,0,0,0
868,39,Edan emang goollnya fabiano!!',0,1,0,0,0,0,0,0,0
869,10519,USER Telpon Pak USER .Masnya pas pilkada kemarkn milih pak USER ?Siapa tahu nasibnya spt USER .ð???ð???,0,0,0,0,0,0,0,0,0
870,2705,Teroris Budha Myanmar menembaki perahu yg ditumpangi anak-anak,1,0,0,1,1,1,0,0,0
871,8007,ORANG INDONESIA BEGO.....,1,1,0,1,0,0,0,0,1
872,7580,USER USER taman rezim skrg di 2019; rakyat sudah muak; #2019GantiPresiden,1,0,0,1,0,0,0,0,1
873,12618,"USER Pesimis Bsa di pidana, secara UU MD3 gtu lho.. Iy to pak USER ??'",0,0,0,0,0,0,0,0,0
874,8761,"USER Bodo amatin aja. Yang kaya gitu, makin dikasih perhatian bakal makin menjadi jadi'",0,1,0,0,0,0,0,0,0
875,6809,USER Anak baek sama culun beda tipis dan /?',0,0,0,0,0,0,0,0,0
876,7577,"USER USER Satu bukti valid lagi, bahaya virus idiot yg diminum oleh (salah satunya) admin USER bisa membuat otak berhenti bekerja saat mulut bicara atau jari menekan keyboard komputer.'",0,1,0,0,0,0,0,0,0
877,2988,USER Main taplak juga cadangan dia mah bocahnya',0,0,0,0,0,0,0,0,0
878,9012,"USER USER USER H h h pikiran org bego itu ,di kira bisa asal nyetak ,bisa inflasi negara...#anak buah kanjeng dimas'",1,1,1,0,0,0,0,0,1
879,3324,Teroris Budha (Govt) mengerahkan CyberArmy. Bikin Hoax &amp; meretas akun-akun Pro-Rohingya!,1,0,0,1,1,0,0,0,0
880,2115,Mungkin dlm sejarah twitter... Cuman saya yg brani jelasin nenek moyang saya... ; ; Tak ada darah PKI loh yaaa... ; ð??? USER USER USER USER,0,0,0,0,0,0,0,0,0
881,4304,USER USER Hush...jangan nyuruh polisi kerja..ntar banyak bom meledak dimana mana',0,0,0,0,0,0,0,0,0
882,461,"USER USER USER USER Emang perlu pak kyai staquf nyebut suku ras biar mudah dipahami nalar ente yg bahlul, ane tanya ente soal arab yg mana yg ente sembah aja gk bisa jawab, ane sodorin arab bani saud yg pro israel eh ente pura2",1,1,1,0,0,0,0,0,1
883,1837,"USER Wkwk masa?\n\nWkwk nanti yerin jadi kotaro, sipit jd pengasuhnya ya ^-^'",0,0,0,0,0,0,0,0,0
884,5560,"USER Worry lessnya susah Ngid kl minum udah kek onta aku tuuuu, minum air biasa atau infused water udah semua \xf0\x9f\xa4\xa3'",0,0,0,0,0,0,0,0,0
885,1089,"Ada saatnya kau menyesal bangsad :v \nKarna saya sakit aja ini, saya jadi gak bisa ngapa-ngapain, tunggu aja saya sehat ya lihat apa yang bisa saya lakuin, bangsad kau.'",1,1,1,0,0,0,0,0,1
886,1967,"Gak apa apa disebut Cebong. Tapi jangan sebut orang lain dengan sebutan kafir, karena kafir tak boleh jadi pemimpin, kafir tak boleh dijadikan teman, kafir harus dimusuhi, dll, dll....\n\nBegitu, tad.'",1,1,0,1,1,0,0,0,0
887,6531,imejin gue sm jebi udh modar ketabrak meteor',0,0,0,0,0,0,0,0,0
888,10086,USER USER Mampus kan luh',1,1,1,0,0,0,0,0,1
889,6519,"Beda tingkat Intelektualitasnya, meskipun bertemu dengan orang yang sama.; #2019GantiPresiden",1,0,1,0,0,0,0,0,1
890,2649,Nak tercabut jantung aku bdk bdk zaman skrg main mercun apa ni smpai bunyi mcm bom',0,0,0,0,0,0,0,0,0
891,5450,"Allahu Akbar !!! Ane benar bangga dan terharu...; ; Jika Suara Rakyat adlh suara Tuhan, Maka USER salah satu Berkah dari Tuhan..; ; Kita pernah punya BK, Soeharto,BJH, USER Yg dihormati Dunia, karena Prestasi mereka yg mendunia...",0,0,0,0,0,0,0,0,0
892,5758,USER : Si AHOAK USER CINA ANJING KAFIR PENISTA AGAMA ISLAM....!!!,1,1,1,0,1,1,0,0,0
893,9725,Bukti nyata Cina Indonesia antek penjajah,1,0,0,1,0,1,0,0,0
