,index,Tweet,HS,Abusive,HS_Individual,HS_Group,HS_Religion,HS_Race,HS_Physical,HS_Gender,HS_Other
1637,11608,Komunis dan liberalis membentuk garis yang melalui ujung barat dan timur bumi bermula dari arah utara menuju selatan bertemu di tanah ini tapi kedua-duanya hancur tanpa ada yang keluar jadi pemenang. Sementara banyak negeri2 besar yang jatuh kedalam pro,0,0,0,0,0,0,0,0,0
1638,12108,USER Dari dulu Ngabalin typekal penjilat\nRumah Polonia dan Kertanegara adalah saksi bisu bagaimana Ngabalin bertingkah',0,0,0,0,0,0,0,0,0
1639,9642,"USER Iya sih. \xf0\x9f\x98\x82\n\nHari ini aja aku abis baca-baca sejarah kelam bangunan di Kota Tua. Sedih banget banyak pembantaian kaum tionghoa saat itu.\n\nTerus aku keinget tragedi 98.\n\nTerus aku mikir. Saat tahun 98, orang indo yang kej",0,0,0,0,0,0,0,0,0
1640,4292,USER Itulah ciri-ciri mental pengemis di sebagian kecil NKRI sebetulnya mampu tapi pura2 tdk mampu dan belaga miskin itu mah sama seperti pengemis di jalanan yg pura2 cacat padahal rumahnya gendong dan punya mobil juga sangat kaya harta',0,0,0,0,0,0,0,0,0
1641,3630,"Ketika prof USER bahas fiksi yg tidak menyinggung agama tertentu tetiba ramai seolah2 penistaan, tp Bu Suk yg jelas2 merendahkan azan, hijab, syariat islam gk berkoar, SITU SEHAT??? #ILCJokowiPrabowoBerbalasPantun",1,0,1,0,1,0,0,0,0
1642,10091,"BUKBER.\n\nEkspetasi gw ya flasback ngebahas ngegoblogan yg pernah dilakukan pas sekola, biar have fun.\n\nRealitanya cuma nngebah kerjaan, menyombongkan diri, menganggap tempat kerjanya sekarang yg terbaik. Kan kntl bgst \xf0\x9f\x98\x92 \n\nDasar Adit,Fajar,Ilmah lu pada !'",1,1,0,1,0,0,0,1,0
1643,12382,Males bgt ngikutin namanya politik indonesia..... gw nunggu presiden yg bisa bkin indonesia semaju singapura bahkan kayak dubai baru gw dkung 1000% ...... politik indonesia mah masih 70% cuit2.. sorry gw ngomong gni karena ini adalah fakta...,1,0,0,1,0,0,0,0,1
1644,1594,USER USER Ini salah satu bangsat pengecut di Indonesia..\nYang didukung bangsat pengecut bani onta dan groupnya yang kabur ke arab sono.\nIngat...Tuhan tidak tidur ...semua yang berbuat spt itu terhadap AHOK dan merasa dirinya pal,1,1,0,1,0,0,0,0,1
1645,6183,Jkw - jkt vs Hambalang. Akhir kisah dari sinetron cebong kampret. Pernah #prediksinggrisjuaraPD2018',1,1,0,1,0,0,0,0,1
1646,5041,USER USER USER USER USER Ga jelas nih admin apa presiden partai ð???asalll banget pokoknyah,0,0,0,0,0,0,0,0,0
1647,11354,Klo sdh berseberangan apa aja ditentang.,0,0,0,0,0,0,0,0,0
1648,10252,USER Cebong mana ngerti ...koplak..koplak',1,1,0,1,0,0,0,0,1
1649,122,Cina perusak bangsa!! Usir !! Stuju??,1,0,0,1,0,1,0,0,0
1650,1166,"USER ayahku tsundere, dingin, jarang omongan canggung gt sama orang asing, tapi kadang receh, dan ga pelit wkwk aku minta apa aja langsung dibeliin saat itu juga beda sama mama yg harus nabung dulu lah.\n\n[baru sampai di madrid jam 2 siang, ja",0,0,0,0,0,0,0,0,0
1651,5279,USER USER USER USER USER USER USER USER USER USER Ada Bani Tai Ngomong..\xf0\x9f\x98\x81\xf0\x9f\x98\x81\xf0\x9f\x98\x80 Ngelantur nih...',1,1,1,0,0,0,0,0,1
1652,12926,USER USER USER USER USER USER Nnyatanya skrg bisa ga tuh si artidjo ngebatalin tuduhan thd si kunyuk USER ?? Kita nonton lagiiiiiiii.....',1,1,1,0,0,0,0,0,1
1653,10765,"USER Terus sekarang kejadian lagi di aku. Aku sekarang sama yang katolik\xf0\x9f\x98\x82 even mama ngelarang, mungkin takut aku nggak bisa jaga pendirian. But i've told him that, i will do the exact thing that my parents do. If you don't, just for",0,0,0,0,0,0,0,0,0
1654,6915,Pemerintah jangan memihak Bastian. Akan kita lengserkan Jokowi jika tidak ikut dan menghalang-halangi AksiBelaIslan,1,0,1,0,0,0,0,0,1
1655,8438,USER Gue gak baca bodo!',1,1,1,0,0,0,0,0,1
1656,1575,USER USER USER USER USER USER USER USER USER USER USER Bilangin wendy unnie suru jemput vider sebelum dia dijual mucikari',0,0,0,0,0,0,0,0,0
1657,5234,"ternyataa setelah nntonin video"" bigfloo selama ini humornya hightop nyampe d otak gw HAHAHAHAHA sarap ni magnae satuu doi kayak 4D dah kalo gk ad doi apa kabar ni grup krik krik \xf0\x9f\x98\x82\xf0\x9f\x98\x82\xf0\x9f\x98\x82'",0,1,0,0,0,0,0,0,0
1658,6677,Soal Ujian Sekolah SD Pendidikan Agama Islam (PAI),0,0,0,0,0,0,0,0,0
1659,4902,Salam alaik. 6 ciri umum yang wajib ada untuk setiap (organisasi/jemaah/partipolitik) (islam) yang telah digariskan oleh ulama. ; ; 1. Rabbaniah; 2. Alamiyah; 3. Syumuliah; 4. Inqilabiah; 5. Waqiâ??iah; 6. Istimroriah,0,0,0,0,0,0,0,0,0
1660,2361,#MataNajwaDebatJakarta lucu banget jawaban ahok.. gak nyambung. Ditanya apa di jawab apa. Kena skak mat d pertanyaan isu agama tdi. Dasar cina tolol hahaha,1,1,1,0,0,1,0,0,0
1661,614,ini jalan dua platform ya\ndi fb juga jalan\nbom yang gede klo mau dapet',0,0,0,0,0,0,0,0,0
1662,758,USER Ayoo ngewe',0,1,0,0,0,0,0,0,0
1663,12234,USER Naik haji pake onta wkwk',0,0,0,0,0,0,0,0,0
1664,7033,RT USER SBY ke 2..nnti pura pura jadi yang paling tersakiti..,1,0,1,0,0,0,0,0,1
1665,7667,Terlepas lo seorang gay atau banci..sejatinya lo seorang laki2 dan harga diri seorang laki2 itu yaitu BEKERJA.',0,0,0,0,0,0,0,0,0
1666,12481,"USER USER USER USER USER USER USER USER Emang bener kawan, aktifis 98 yg di gerakan LB MURDANI Biayai anak2 GMNI, yg notabene organisasimahasiswa bentukan pki.'",0,0,0,0,0,0,0,0,0
1667,6965,USER USER Baru tau ada presiden ekonomi he he emang yang milih menko anda ya,0,0,0,0,0,0,0,0,0
1668,11941,"USER Gua cecann...napa rep"" an pd bilang gua monyet dahh \xf0\x9f\x98\x82'",0,1,0,0,0,0,0,0,0
1669,7691,USER USER Memang KAMPUNGAN dan NORAK baru tau ?',0,1,0,0,0,0,0,0,0
1670,6920,USER IYA KNTL MANIS :)',0,1,0,0,0,0,0,0,0
1671,7304,Polri Benarkan Tangkap Prabowo atas Kasus Penghinaan Presiden di media sosial URL Hukum Penghinaan Jokowi Megawati,1,0,1,0,0,0,0,0,1
1672,12100,#Boikotindosat ini si kuning taiiii pulsa pagi tadi Rp. 2000 an masih kepotong juga tinggal Rp. 1. padahal gk di ngapain... bener gk menghargai pelanggaan sepertinya. budek... taiiiii',1,1,0,1,0,0,1,0,0
1673,12005,"USER Propaganda agama selalu pembrontakan dipimpinUlama atau Ustaz.Tetapi buktinya tidak pernah ada ulama/ustaz yg ditangkap apalagi dibuang ke BovenDigul,.Yg ada adalah tahanan NASOMALISdan KOMUNIS.Ada bukti",0,0,0,0,0,0,0,0,0
1674,6520,Persebaran ekonomi dan kemakmuran harus kita jamin diterapkan dengan adil dan merata; ; Madura dapat dijadikan sebagai pusat ekonomi syariah di Jawa Timur.; ; Kabeh Sedulur Kabeh Makmur; ; #GusIpulMbakPuti #kabehsedulurkabehmakmur #jatimsedulur #satriamadu,0,0,0,0,0,0,0,0,0
1675,9187,Semoga Panglima TNI bisa menyelamatkan NKRI dari para penjual aset negara dan dari antek-antek komunis,1,0,0,1,0,1,0,0,0
1676,3825,URL &lt;-pacar lesbi #bokep #teen #porn #xxx',0,1,0,0,0,0,0,0,0
1677,314,"USER USER Kalo kejadian disini, mungkin juga kalian yg triak paling lantang ""pmrth pro aseng"" duluan pas ditawari bantuan asing. Bikin posko ini itu yg intinya malah ngomporin keluarga korban sue pmrth. Bilang 15 hari kelamaan, harusnya 3",0,0,0,0,0,0,0,0,0
1678,8623,"USER USER bilang jokowi itu kacung gua,itu sangat jujur sekali,tapi ebonger diam bisu tuli'",1,1,0,1,0,0,1,0,0
1679,11123,USER Ngewe trus krj qm.sekali2 donk ma kita2.hehe',0,1,0,0,0,0,0,0,0
1680,3916,Universitas Islam Rohingya di Maungdaw dibakar Teroris Budha (12/9).,1,0,0,1,1,0,0,0,0
1681,12067,"USER Hu uh ya lama lama.kayak sedikit alay gt drama nya, wahh expansi sampai ke cina ini nntn drama nya'",0,0,0,0,0,0,0,0,0
1682,8756,"Hati - hati modus baru kampanye hitam partai Alloh &amp; partai syaitan unt. menjatuhkan lawan politik... setelah isu PKI gak mempan, isu utang negara gak mempan, isu negara bubar mental dan isu isu lainnya .... sekarang isu partai Alloh &amp; partai sya",0,0,0,0,0,0,0,0,0
1683,5106,Pemerintah anti kritik Pemerintah anti Islam Pemerintah antek PKI Pemerintah antek Yahudi alasanbikinaksi kantaibanget,1,1,0,1,1,1,0,0,0
1684,5263,USER USER USER orang udik nggak tahu tanah abang',1,1,1,0,0,0,0,0,1
1685,5731,Ternyata ada yang lebih culun daripada pasangan lovren mignolet... \xf0\x9f\x98\x82',0,1,0,0,0,0,0,0,0
1686,8448,"USER Ini pasti anak"" Cebong n Kampret yg masih polos ga ikut""an Cebong n Kampret Tua \xf0\x9f\x98\x82\xf0\x9f\x98\x80\xf0\x9f\x98\x84\xf0\x9f\x98\x84\xf0\x9f\x91\x8d\xf0\x9f\x91\x8d\n\xe2\x98\x95\xe2\x98\x95'",1,1,1,0,0,0,0,0,1
1687,2984,Hang buat event majlis berbuka puasa. Tapi hang tak puasa. Bangkai.',1,1,1,0,0,0,0,0,1
1688,5483,"USER Muhammad menurut Quran manusia BEJAD, sangat jelas kan?",1,1,0,1,1,0,0,0,0
1689,3051,"USER Wonu oppa kenapa matanya sipit banget? '^'""",0,0,0,0,0,0,0,0,0
1690,3085,USER tidak boleh tidur kerana najis akan menjadi nyata',0,1,0,0,0,0,0,0,0
1691,6329,USER USER Ewe ewe berhadiah',0,1,0,0,0,0,0,0,0
1692,2773,USER Kok aku ra asing karo kui yo',0,0,0,0,0,0,0,0,0
1693,12531,"USER Wkwkwk iya betul juga sih.. jadi saksi bisu kegalauan.. ampe sempet mikir, nih anak stress knp sih?\xf0\x9f\x98\x85\neh, tapi taunya besok2nya malah tweetnya isinya JKT48\xf0\x9f\xa4\xa3'",0,0,0,0,0,0,0,0,0
1694,6702,USER Si dongo dah numpang makan ma rakyat kerjanya cuma bisa nyinyir....',1,1,1,0,0,0,0,0,1
1695,5318,Kajox ga on si kunyuk deact si tete ilang entah kemane -_- abis dah bestie cowo yg gua punya',0,1,0,0,0,0,0,0,0
1696,7170,USER AYO DILANJUT KE CERITA NYA',0,0,0,0,0,0,0,0,0
1697,2621,USER USER lu kampang',1,1,1,0,0,0,0,0,1
1698,7843,USER halah kntl',1,1,1,0,0,0,0,1,0
1699,2095,"Ya Robbi, tunjukkan kepada hamba jalan yang Engkau ridhoi, jauhkan hamba dari segala godaan syaiton yang terkutuk'",0,0,0,0,0,0,0,0,0
1700,5216,USER USER Cebong ngomong data....??? \xf0\x9f\x98\x82\xf0\x9f\x98\x82\xf0\x9f\x98\x82',1,1,1,0,0,0,0,0,1
1701,11463,"USER Pak USER penjelasan berikut untuk mendorong Anda, mau mengklarifikasi kebenaran 25 Nabi Islam",1,0,0,1,1,0,0,0,0
1702,8029,Misi4: Membangun masyarakat yang gotong royong toleran dan harmoni selaras nilai budaya Jawa Barat yang luhur #Asyikm3nang,0,0,0,0,0,0,0,0,0
1703,7518,"USER USER Bagi yg Muslim tahan diri, Pak USER tidak spesifik menyebut Kitab Suci agama manapun. Boleh jadi Muslim sesama Muslim sedang diadu domba dg bawa2 Al Qur'an disini. Salam",0,0,0,0,0,0,0,0,0
1704,838,"USER Dari ngebunuh musuh, dari ngebunuh minion, dari ngebunuh turtle, dari ngebunuh monster hutan, dari assist, dari ngancurin turret, dll.\n\nAmbil, lu kata ML atm wkwkwkw kampret XD'",0,1,0,0,0,0,0,0,0
1705,8159,"USER USER USER Ngga boleh gitu mas. Kafir ato enggak biar Tuhan yg urus. Kita ngurus pikiran, ucapan, tulisan dan perilaku kita sj. Dlm Hindu itu disebut Tri Kaya Parisudha. Pikiran, ucapan dan perbuatan hrs baik. Kita tdk bisa me",0,0,0,0,0,0,0,0,0
1706,7629,"Ohiya, kenapa sekolah yg mayoritas tionghoa justru mereka yg dibedakan? Gatau, pribumi nya juga banyak 11/12 lah. Kepseknya juga pribumi..'",0,0,0,0,0,0,0,0,0
1707,9659,TNI HARUS BERGERAK PKI SUDAH BANGKIT DAN MERAJALELA......!!!!LENGSERKAN JOKOWI GagAL TOTAL MEMIMPIN INDONESIA. URL,1,0,1,0,0,0,0,0,1
1708,6581,"USER Lah kalo lesbi mana nganggep dirinya salah? apasalahnya cinta kan?\nMaap nih, aku normal, tapi gapernah nanggep yang lesbi/gay/bisex sbg ""kesalahan"" \xf0\x9f\x98\xad\xf0\x9f\x98\xad\nAku pgn hidup berdampingan sm org2 yang ""dipandang sebelah m",0,0,0,0,0,0,0,0,0
1709,5816,dekalarasi pilkada 2018 aman dan anti hoax perangkat desa kedungrejo jabon,0,0,0,0,0,0,0,0,0
1710,12312,USER Percuma gak perlu di ingetin bang USER klo orang di hatinya sudah tertanam sifat dan ajaran iblis orang itu pastin lntolerans. Dan dia Akan mngadu domba. Tabur kebncian. Sara dll',0,1,0,0,0,0,0,0,0
1711,11961,"USER USER USER USER USER USER USER Pilihan yg tepat dan msk akal adlh USER menyatukan kader USER dan luar jawa.oratornnya bak soekarno,menggelora membawa militansi kader ke titik tertinggi dan",0,0,0,0,0,0,0,0,0
1712,2309,Seksyen 2 Mega #Utusan Malaysia 11April; #lebihdaripadapolitik; Beli #UtusanMalaysia atau langgan #islam #muslim #alquran #keluarga #wanita #kesihatan #hiburan #artis #budaya #sains #teknologi #alamsekitar #alumni #kampus #universiti #wira #tentera #polis,0,0,0,0,0,0,0,0,0
1713,6260,"Kalo gak jd Presiden, tlg serahkan sj daftarnya Pak! Yg terpenting 100 org tsb dibikin merana! USER USER #2019GantiPresiden",1,0,0,1,0,0,0,0,1
1714,3384,"Tomohon juga merupakan pusat pembelajaran agama Kristen dan Katolik. Ada tempat khusus untuk berdoa dan meditasi yang disebut Bukit Kasih, sebuah tempat suci yang indah dan tenang. #TomohonInternationalFlowerFestival\n\nNor'",0,0,0,0,0,0,0,0,0
1715,6908,Masak WAKIL RAKYAT tidak memberikan CONTOH yg baik untuk rakyatnya dalam membayar TAGIHAN listrik?; ; Kenapa bisa sampai listrik tidak bayar? ; ; Mau salahkan JOKOWI karena TINGKAT EKONOMI lesu &amp; membuat FADLI ZON tidak bayar listrik ??; ;,1,0,1,0,0,0,0,0,1
1716,1766,Aye senang banget dengan melihat foto ini... Kemesraan Presiden Jokowi dengan Ulama,0,0,0,0,0,0,0,0,0
1717,388,MEWASPADAI CINA KOMUNIS YANG ADA DI INDONESIA!,1,0,0,1,0,1,0,0,0
1718,2072,"USER cebong takut anies akan mnyapu habis got"" slruh indonesia.....hingga cebong gak bisa hidup lagi.'",1,1,0,1,0,0,0,0,1
1719,4323,"USER USER Ah masa iya? Kata siapa bawa-bawa agama udah gabisa berkata-kata? Justru karna gua cerdas makanya gua bawa-bawa tuh agama, nah itu lu tau sekecil apapun kata goblok tetap terlihat olehNya, lalu gimana lu? Udah slutsharming, udah ga respect sesama manusia, heran saya'",0,0,0,0,0,0,0,0,0
1720,125,"Mau tanya serius ini sm presiden jokowi======= knp yg ada cm islam nusantara,knp tdk ada kristen nusantara,budha,hindu bahkan kong huchu nusantara???'",0,0,0,0,0,0,0,0,0
1721,2215,Cara paling rasional dan realistis dalam menilai kepemimpinan Presiden Jokowi adalah: sejauh mana dia telah membawa perbaikan dalam berbagai aspek pembangunan dan kesejahteraan masyarakat dibandingkan dengan sebelumnya. Jika cukup banyak maka sangat layak,0,0,0,0,0,0,0,0,0
1722,9173,Si Mae mental wor nya keren di teel... Lama kelamaan minggat n nyungseb layani gw... Apalagi cebong baru netes... Wkwkwkwk bisa modar mendadak.... \xf0\x9f\x98\x9d\xf0\x9f\x98\x9d\xf0\x9f\x98\x9d\xf0\x9f\x98\x9d',1,1,1,0,0,0,0,0,1
1723,1777,"USER USER USER MATAMU PICEK A? Duit gak ada maksa beli, hutang belum release baru mau disiapkan 11 bank sudah koar2. Entar waktu bayar dana gak ada jawabnya "" BUKAN URUSAN SAYA "". DUNGU PLUS KOPLAK diambil semua'",1,1,1,0,0,0,1,0,0
1724,1778,"Laki-laki itu memakai cincin tengkorak, sepatu berwarna putih, tahi lalat di dagunya. Perempuan itu bermata sipit, berambut panjang, dan manis senyumnya. Sederhana, cinta mereka turut membuat aku bahagia'",0,0,0,0,0,0,0,0,0
1725,5023,USER USER LAHSI KAMPANG GUA DI DULUIN PARAH LO JEP KAN GUA JOMBLO SNDRI NIH',0,1,0,0,0,0,0,0,0
1726,8999,USER USER USER scene edan \xf0\x9f\x98\x85\xf0\x9f\x98\x80\xf0\x9f\x98\x85\xf0\x9f\x98\x80\xf0\x9f\x98\x85\xf0\x9f\x98\x80\n\ntnggal 18 may tanggal keramat',0,1,0,0,0,0,0,0,0
1727,6862,RT USER Tim Anies-Sandi ya? Perlahan bau harum terxium dari orang-orang yg berkerja di tim itu dan 1 per 1 sudah mulai tercydux bener semua,1,0,0,1,0,0,0,0,1
1728,11114,"USER Ribut harga mulu, perasaan gw sih harga telur sama daging dr jaman psk Beye sampai skrg, segitu2 aja, telor doang 24rb/kg masa ga bisa beli, ga bisa beli daging? Burger harga promo mulu tuh'",1,1,1,0,0,0,0,0,1
1729,12520,"Baru pertama kali gue bener2 naksir sama cowo yg mukanya asia parah, i mean....sipit, putih, adohhh gilak gue bener2 tergila2'",0,0,0,0,0,0,0,0,0
1730,325,"USER bagi anda mungkin gk apa2, tapi bagi kami Muslim ini sangat menghinakan kami. Iblis betina itu sdh menista syariat kami'",1,1,1,0,1,0,0,0,0
1731,7856,"Siyaaaaap Ndan RT""USER: Tolong jgn kait-kaitkan kasus ijp dgn anies sandi apapun yg boleh dikait-kaitkan cuma yg berhbgan dgn ahok/jokowi aja.",1,0,1,0,0,0,0,0,1
1732,9392,Pilkada akan tetap sejuk asal elit tidak memancing untuk gaduh.. Pak Presiden sebagai simbol utama negara harus mampu berperilaku dan bertutur yang menentramkan..,0,0,0,0,0,0,0,0,0
1733,5271,"Kunjungi Turki, 'Gubernur Indonesia' USER Bertemu Presiden USER Gubernur DKI Jakarta Anies Baswedan melanjutkan kunjungannya ke Turki. Anies bertemu Presiden Turki Recep Tayyip Erdogan dan menjalankan salat Jumat bersama.",0,0,0,0,0,0,0,0,0
1734,10451,"USER hallo, nama saya furi, saya adalah seorang katholik bahkan dari negara ini belum merdeka, saya bisa angkat galon ngobrol juga kok :)'",0,0,0,0,0,0,0,0,0
1735,8598,"USER woiii kampret!!! gelik gue liat lu,belagu amat jd orang.songong!!! minta di penci jidat lu hah?!!'",1,1,1,0,0,0,0,0,1
1736,9972,"Kenapa bukan aksi turunkan jokowi? Biar selamat indonesia, pak USER gak malu nyapres lagi?",1,0,1,0,0,0,0,0,1
1737,6387,RT USER: #SANGE_AAAAAAAAAAH #memek gatel say pngen disruduk kontol ! Retweet sayang yg pngen #ngentot \xf0\x9f\x98\x98 kuy... URL,0,1,0,0,0,0,0,0,0
1738,10933,"USER Lebih geblek, kalo udah merit malah suka nelponin terus kak \xf0\x9f\x98\x82\xf0\x9f\x98\x82\xf0\x9f\x98\x82\xf0\x9f\x98\x82'",0,1,0,0,0,0,0,0,0
1739,3386,RT USER: #IklanAhokJahat bikin darah mendidih. bangsat penuh dengan propaganda. emang lo kira islam radikal ?Kalau kami mau,1,1,1,0,1,0,0,0,0
1740,12530,"Banyak Laporan tentang Gafatar, Kami Rekomendasikan Dilarang Yg harus dilarang ISLAM #hikdun",1,0,0,1,1,0,0,0,0
1741,4359,USER ahok si kutil babi kembali ke rumah lembang kenapa jakarta jadi banjir bud?,1,1,1,0,0,0,0,0,1
1742,3863,3. Ya. Aku seorang katolik sejak kecil. Tidak ada alasannya. Mungkin karena orangtua.',0,0,0,0,0,0,0,0,0
1743,2907,USER USER Saya selalu mengikuti diskusi ttg Islam Nusantara ini.. menarik sekali tapi saya belum berani komment Prof.. dan saya terkesan dg komment pak Budisepang ini.. saya penganut Kristen Jawa.. \xf0\x9f\x98\x8a syallom...',0,0,0,0,0,0,0,0,0
1744,9436,Dukung saja Pak de... ahok Anda dukung juga kan!! RAKYAT sudah semakin faham...cerdas..mana PEMBUAL mana PEMIMPIN URL,1,0,1,0,0,0,0,0,1
1745,5891,"#2019GantiPresiden Mulai Main Kasar atas nama agama, ulama, ustaz dan uztazah Forum Ulama Umat Indonesia USER USER agar ditindaklanjuti",0,0,0,0,0,0,0,0,0
1746,6624,USER USER kalo USER gak laporin USER sekalian brarti fix klo satu gerbong... ð???ð???,0,0,0,0,0,0,0,0,0
1747,12641,"Pilkada Damai 2018 ; Aman, Damai dan Bermartabat; USER USER",0,0,0,0,0,0,0,0,0
1748,6759,BRENGSEK BOYFRIEND SEKALI AKU GA KUAT',1,1,1,0,0,0,0,0,1
1749,2463,Faham betui betui maksud menegakkan agama Allah dengan berjihad sepenuhnya,0,0,0,0,0,0,0,0,0
1750,2589,USER USER Dasar culun dan plongo...',1,1,1,0,0,0,0,0,1
1751,809,USER Oii turo bom? Kajakkk',0,0,0,0,0,0,0,0,0
1752,7604,USER kalau boleh saya ngomong ingin saya katakan ahmad dhani monyet babi anjing. tapi itu tidak boleh,1,1,1,0,0,0,0,0,1
1753,4701,RT USER USER USER USER Indeks demokrasi menurun pegimana dengan indeks Komunis/PKI dan Otoritarianisme?,1,0,0,1,0,1,0,0,0
1754,10883,USER 1. Tidak Perih pada Luka Sariawan \n2. Kemasanya Finger Off yang tidak bersentuhan dengan luka \n3. Mengandung Ekstrak lidah buaya \n4. Aman Digunakn Bayi &amp; Anak-anak \n5. Memiliki Rasa Manis \n6. Tidak bereaksi terhadap Obat lain \n7. t,0,0,0,0,0,0,0,0,0
1755,1758,"Tweet in English tak bermakna dia ""Bajet Hot"".; ; Tweet banyak melayu tak bermakna dia ""So Kampung"".; ; Tweet Islam tak bermakna dia ""Bajet Alim""",0,0,0,0,0,0,0,0,0
1756,11641,"YF siapapun ngewe yok, bete banget gua'",0,1,0,0,0,0,0,0,0
1757,5401,"Di Kazakhstan, kartun SpongeBob SquarePants dilarang, karena kartun ini menciptakan sebuah budaya holiganisme, kekerasan, dan bullying.",0,0,0,0,0,0,0,0,0
1758,3680,GAPERNAH MENDALAMI AL-QURAN YA BANG??? PANTESAN MULUTNYA KAYA ORANG KAFIR BEJAT HINA USER',1,1,1,0,1,0,1,0,0
1759,70,"RT USER: Bajingan Homo!!!\nHati2 terhadap anak2 kita terutama di kamar mandi laki2, jgn biarkan sendiri! URL",1,1,1,0,0,0,0,1,0
1760,9068,"USER USER USER USER USER USER USER USER USER USER USER USER km ga up date berita jokowi saat ini tdk bs meneruskan bbrp proyek alias mangkrak, usia pemerintahan msh seumur jag",0,0,0,0,0,0,0,0,0
1761,10730,USER makanya otaknya diupgrade dong\n\nkan ena invisible bisa liat anu\n\nsaya mau jadi mas kunti aja bisa terbang',0,0,0,0,0,0,0,0,0
1762,1388,Hidup kena kerja keras jangan harap kena suap bajingan',0,1,0,0,0,0,0,0,0
1763,12116,USER USER USER Mau debat sama anak yg dikuliahin tapi bisa dibegoin?\nBajingan emang orang kayak elu ya bikin indon sengsara URL,1,1,1,0,0,0,0,0,1
1764,3394,USER rezim tukang nipu. hoax . anti kritik',1,0,0,1,0,0,0,0,1
1765,4775,"USER Pak USER sbelum berani umumkan Muhammad Nabi Gadungan, Anda hrs dorong KPAI mlarang anak mengaji",1,1,0,1,1,0,0,0,0
1766,3684,Bagaimana mungkin Kementerian Agama menghapus Teroris Islam di Indonesia? USER Lukman Hakim S. tidak paham Islam,1,0,0,1,1,0,0,0,0
1767,7955,USER Hati2 yang nyebarin video bom meledak mau ditangkap',0,0,0,0,0,0,0,0,0
1768,11413,RT USER keris kok di letakkan di depan? Ngajak perang siapa hati-hati bntr lg dipecat sama USER,1,0,1,0,0,0,0,0,1
1769,2492,"USER USER Sejelek2nya Jokowi, jk di sandingkn dgn Prabowo, masih jauh, dr jejaknya saja rakyat sdh tau, mungkin jk bkn Prabowo masih bs di pertimbangkan utk tdk milih Jokowi. Hemm buta mata boleh mas, tp jk hati yg sdh di butakan oleh p",0,0,0,0,0,0,0,0,0
1770,811,"USER Setahu saya prambanan adalah candi hindu. (kelompok candi dieng, candi ungaran gedong songo dll). Borobudur adalah candi budha (kelompok sewu kalasan mendut dll).'",0,0,0,0,0,0,0,0,0
1771,8102,Merindukan mu bearti mengajari ku untuk menjadi pembunuh ulung...\n\nSebab rasa rindu yang ada harus segera aku bunuh agar tak menjadi bom waktu yang bisa menghancurkan semuanya *eaakkk',0,0,0,0,0,0,0,0,0
1772,1995,USER Ga sekalian lu jadiin gua anak nih biar makin sarap',0,1,0,0,0,0,0,0,0
1773,3022,"pantesan namanya kaya gak asing, ternyata Lalu...'",0,0,0,0,0,0,0,0,0
1774,7850,"USER Daripada ikut Pilkada yang udah pasti gak menang mending voting nama bapak di polling saya aja pak, kali aja beneran jadi pelatih timnas.",0,0,0,0,0,0,0,0,0
1775,662,USER USER USER USER Pencipta hoaxs ya presiden dan wakilnya',1,0,1,0,0,0,0,0,1
1776,1853,"USER USER Lah, serius? Macem umat katolik dulu sebelum renaissance? Kok gitu \xf0\x9f\x98\x95'",0,0,0,0,0,0,0,0,0
1777,7048,Kita semua hanyalah UMAT,0,0,0,0,0,0,0,0,0
1778,5829,RT USER: Stw bali...erma suka kontol.. URL,0,1,0,0,0,0,0,0,0
1779,6311,USER USER Cina cuma jadi benalu nkri \xf0\x9f\x90\xb7\xf0\x9f\x90\xb7\xf0\x9f\x90\xb7',1,1,0,1,0,1,0,0,0
1780,11940,Katanya otoriter. Kalau otoriter seperti pemimpin Korut mungkin yg tidur itu udah dihukum mati sama Kim Jong un,1,0,1,0,0,0,0,0,1
1781,2096,RT USER saat AR sehat saja jd calon presiden dia dipukul oleh SBY apalagi jelang pikun atau malah sdh pikun,1,0,1,0,0,0,0,0,1
1782,12606,USER USER USER cebong kan otak nya cuma sak upil',1,1,0,1,0,0,0,0,1
1783,2744,USER USER USER USER USER USER USER USER USER USER USER USER USER USER USER USER Masalahnya si banci dengan akun palsu itu bilang utang pemerintah era USER,1,1,1,0,0,0,0,1,0
1784,831,"USER USER USER USER Sama bli senang punya saudara bli, kebetulan saya senang mempelajari Hindu Bali, untuk menambah wawasan.\nDan karya karya Gde Prama juga menarik untuk dibaca perluasan wawasan.'",0,0,0,0,0,0,0,0,0
1785,10168,PEMBUNUHAN karakter MayJen Kivlan Zein & USER oleh Rezim yg jelas antek Komunis saat ini bisa diwakili dari Ftho diatas...,1,0,1,0,0,0,0,0,1
1786,165,"Giat Bhabinkamtibmas Brigpol Mbs Sihombing pd hari ini, Rabu 11 April 2018 melaks sambang desa dan tatap muka sekaligus monitoring Kamtibmas menuju Pilkada 2018 di Desa Lobusiregar I, tepatnya dirumah Rudi Panjaitan, Helman Siahaan dan Hotman Siahaan",0,0,0,0,0,0,0,0,0
1787,7821,"USER Wahai saudaraku, ketahuilah bahwa, Jokowi adalah tetap saudara kita. Yg patut kita tinggalkan adalah para partai politik pendukung penista agama, orang2 yg mendukung penista agama, penduduk zionis Israel, kaum munafik, liberal, komunis d",0,0,0,0,0,0,0,0,0
1788,10200,Ambik course graphic design tapi bergaya semacam pergi class macam budak fashion\n\nYaa setan budek takkan aku nak pakai baju tidur pergi class hanat.\nYe tahu designer takda masa tapi aku ada masa untuk appearance aku noted that\n\nMaju lu sini anjing',1,1,1,0,0,0,0,0,1
1789,7965,"Pas Reza Rahadian bilang...\n\n""Aku itu buta, bukan mati rasa.""\n\nBanyak hati yang patah.'",0,0,0,0,0,0,0,0,0
1790,11554,USER Bacot lu diyem',1,1,1,0,0,0,0,0,1
1791,5232,RT USER: ummi sampe kempot2 gitu pipi nya....doyan ya ummi sedot kontol URL,0,1,0,0,0,0,0,0,0
1792,7652,USER papah matamu picek',1,1,1,0,0,0,1,0,0
1793,1656,"Sengaja itumah, tapi rakyat ga bodoh, smoga sgera ganti presiden amin",1,0,1,0,0,0,0,0,1
1794,1143,budha membantai muslim rohingya,1,0,0,1,1,0,0,0,0
1795,12545,Tahun 1999 poros tengah bisa terbentuk dikarenakan pemilihan presiden melalui mekanisme MPR; Namun saat ini pemilihan presiden oleh rakyat; ; TIDAK MUNGKIN ADA POROS KETIGA,0,0,0,0,0,0,0,0,0
1796,2518,Agus silvy Tukang Fitnah DebatFinalPilkadaJKT,1,0,1,0,0,0,0,0,1
1797,3196,USER Situ juga sarap berarti anjer',1,1,1,0,0,0,1,0,0
1798,2004,USER SIRIK AE LU ONTA\xf0\x9f\x98\x83',1,1,1,0,0,0,0,0,1
1799,4016,"RT USER: Bos Korea gua itu awalnya ga percaya yg begituan, meskipun banyak kejadian di pabrik. \n\nOrang yg kesurupan dia bilangnya\xe2\x80\xa6'",0,0,0,0,0,0,0,0,0
1800,2570,USER Sitip apa siapa',0,0,0,0,0,0,0,0,0
1801,5116,"Tasik Chini yg diiktiraf Rizab Biosfera oleh UNESCO sesungguhnya kaya dengan khazanah alam semulajadi, flora &amp; fauna.; ; Namun sejak 2009, persekitaran kawasan itu semakin terjejas akibat kegiatan pembalakan, perlombongan &amp; perladangan yg tidak ter",0,0,0,0,0,0,0,0,0
1802,7307,Ini yangmembuat #2019T3tapJokowi,0,0,0,0,0,0,0,0,0
1803,4509,"cinta itu buta \nbuta itu mata \nmata itu bulat \nbulat itu telor \ntelor itu kuning \nkuning itu eek\nberati, cinta itu eek'",0,0,0,0,0,0,0,0,0
1804,12971,Allahu Akbar Gaduh Karena Ahok Rakyat Bersama FPI Bubarkan GMBI Copot Kapolda Jabar penjarakan ahok,1,0,0,1,0,0,0,0,1
1805,12301,"USER BILA AKU DGR GO GO EN PART JK YG DIA SEBUT ""MADE"" TU AKU SUKA GILA HAHAHAHAH'",0,0,0,0,0,0,0,0,0
1806,8692,"Pengusaha China : Kalau Reklamasi Pulau G Batal, Jokowi Kami Lengserkan! URL",1,0,1,0,0,0,0,0,1
