,index,Tweet,HS,Abusive,HS_Individual,HS_Group,HS_Religion,HS_Race,HS_Physical,HS_Gender,HS_Other
2505,1103,"Berdalih 4 pilar, MPR dungukan & biadabkan bangsa, dakwah Islam menyeru nyembah2 Allah SWT benci kafir, mecah bangsa",1,1,0,1,1,0,0,0,0
2506,3536,USER USER Partai sompret ini bakal bubar sendiri. Siapa yg mau pilih?',1,1,0,1,0,0,0,0,1
2507,7874,RT USER BPK jangan diam sj kok di menggebuk di dpr,1,0,1,0,0,0,0,0,1
2508,8498,#2019GantiPresiden scra konstitusional hak setiap rakyat woiii!! . Planga plongo tapi kelakuan otoriter.,1,1,1,0,0,0,0,0,1
2509,2573,USER USER Iya jg sih.. Yg bilang banyak aseng &amp; ga jg anggota dpr.. Trus bgmn donk..',0,0,0,0,0,0,0,0,0
2510,7622,"Kepala Seksi Perlindungan dan Pemberdayaan BP3TKI Padang Valerie Chistie Faisal, S. Pd memdampingi TKI Purna binaan BP3TKI Padang dalam survei yang dilakukan oleh Tim penilaian Badan Ekonomi Kreatif Indonesia... URL",0,0,0,0,0,0,0,0,0
2511,7384,Bualan ke berapa nih pak jokowi? Ngomong mulu URL,1,0,1,0,0,0,0,0,1
2512,9816,USER Ya udah supaya g lompat #2019GantiPresiden,1,0,1,0,0,0,0,0,1
2513,9100,"USER USER USER USER USER Mmg Rezim saat ini bnyk oknum POLRI yg Arogan,ini Krn Rakyat sgt lemah dan Hukum tumpul keatas dan tajam ke bawah.'",0,0,0,0,0,0,0,0,0
2514,3229,USER USER Kau pikir aku ni kapir sangat ke hanat?',0,1,0,0,0,0,0,0,0
2515,2054,"Digrebek sama Jokowi yang disalahkan Demokrasi, FPI lah...tegas dong mas bro USER USER Jokowi OTORITER...hehehe",1,0,1,0,0,0,0,0,1
2516,1490,USER bubarkan saja KPK fud.. Jadikan org tersangka asal asalan.. Kalah ni skrg,1,0,0,1,0,0,0,0,1
2517,11539,USER Eh nurull kuliah dimana? Jurusan apa? Ha bahasa mandarin? Berarti kerja sama dong sama komunis ? Wah masih saudaraan dong sama g30spki',0,0,0,0,0,0,0,0,0
2518,6819,USER Kemaren gubernur pilihan umat impor bawang dari cina kok ga ada yg teriakin antek aseng',0,0,0,0,0,0,0,0,0
2519,577,Ga apa sih Ahok prnh diblng penista agama tp ga kek politikus koruptor dipanggil urusan hukum ngeles pake sakit hati-hati ntar keterusan mati.,1,0,1,0,0,0,0,0,1
2520,10491,USER USER Udah d jamin emang pasti hidup tenang sm bahagia klo ganti presiden???',0,0,0,0,0,0,0,0,0
2521,3877,USER USER Tolol jijik',1,1,1,0,0,0,0,0,1
2522,12625,"Bentar lagi saya mau kultwit menanggapi pandangan USER soal fiksi. ; ; Saya tak setuju RG dikriminalisasi. Lawanlah ide dgn ide! ; ; Bahwa kaum sumbu pendek tumben ga koar2 menghujat RG dgn alasan penodaan agama, ya disyukuri aja. Mgkn mrk mau bela",1,0,0,1,1,0,0,0,0
2523,5261,"Presiden Jokowi sudah merampungkan 30 proyek strategis nasional (PSN) periode 2016-2017 senilai Rp 94,8 triliun.; ; Kita dukung pak Jokowi 2 periode yang sdh terbukti serta melanjutkan pembangunan berkesinambungan.; USER; ; #2019TetapJokowi ; #Jokowi2Pe",0,0,0,0,0,0,0,0,0
2524,10046,ayo lengserkan si joko,1,0,1,0,0,0,0,0,1
2525,124,Mari kita wujudkan Pilkada Kota Bengkulu 2018 aman dan damai.; .; .; coki_adem86 98heruâ?¦,0,0,0,0,0,0,0,0,0
2526,2956,USER Apakkk kau babi \xf0\x9f\x96\x95\xf0\x9f\x98\x91',1,1,1,0,0,0,0,0,1
2527,4996,"USER Pak USER kumpulkan semua ahli Islam, Anda instruksikan cari Inti Islam hasilnya pasti sperti ini",0,0,0,0,0,0,0,0,0
2528,3336,"Teriak ""bubarkan PKI"" itu bagai orang yang pulsa listrik rumahnya habis tetapi malah mengutuk semua orang karena ketidaktahuannya sendiri",1,0,1,0,0,0,0,0,1
2529,2746,"081223555353 - Jika aku berkata, aku tak lagi membutuhkanmu. Maka aku adalah orang munafik, karena dalam setiap hariku, ak #JualForediJogja'",0,0,0,0,0,0,0,0,0
2530,12148,"Sayang sekali Bangsa ini Paling jago kalau merasa-rasa. Yg mendukung Pak Ahok merasa paling benar, yg mendukung Mas Anies merasa paling suci",1,0,0,1,0,0,0,0,1
2531,3765,USER Klo smua pengurus partainya di penjara siapa yg jdi DPR mbak? Ganti sya aja ya :p',0,0,0,0,0,0,0,0,0
2532,10588,RT USER USER kebesaran jiwa anies?? yang ada kebesaran ego dan ambisi. liat cara kampanyenya yang brutal 11 12 ama sandi,1,0,1,0,0,0,0,0,1
2533,13048,"USER USER USER USER Yang gue tahu.. Negara lain sibuk perang dagang disini perang ayat, disana sibuk ke Mars disini sibuk ayat...dst\nSibuk teriak anti ASing dolar minggat mumet.. Aku diblokir demo..'",0,0,0,0,0,0,0,0,0
2534,3910,USER Gaya pengumpylan masa PKI',0,0,0,0,0,0,0,0,0
2535,6161,"Anak2ku yang besok menempuh Ujian Nasional siapkan diri dengan baik, kosentrasi belajar & berani jujur untuk raih prestasi terbaik",0,0,0,0,0,0,0,0,0
2536,11595,USER // ...Harus tau ya emang? Saya juga asal gas. HAHAHA. Aslinya anaknya buta arah sama gak tau tempat selain domisili mun.',0,0,0,0,0,0,0,0,0
2537,10908,"sekalinya lagi ngecekin perintilan eh nilai ada yg nyangkud, silit.'",0,1,0,0,0,0,0,0,0
2538,6978,"USER USER USER Media aseng mainstream mana mau memberitakan pendapat/suara para Kyai/Ulama garis lurus, sehingga tak terdengar di skala nasional..\n\n#SaveNU'",0,0,0,0,0,0,0,0,0
2539,3199,"USER manusia2 tolol semua pada takut Ahok keluar, kasian bangat hidup kalian disana, bengitu idiot and stupid.'",1,1,0,1,0,0,0,0,1
2540,12263,"USER USER USER Dalam konsep agama islam..orang kafir semacam abu jahal, pengemis ato pemuka agama,.gak boleh difitnah..gak boleh dicaci..'",0,0,0,0,0,0,0,0,0
2541,7226,"USER Pak USER utk menghapus Teroris Islam & PENIPUAN, perlu ada penjelasan agar Islam mudah dipahami",1,0,0,1,1,0,0,0,0
2542,3461,"USER wkwk mampus lo jung, ruby'",1,1,1,0,0,0,0,0,1
2543,211,"USER kayak memegang, bukan mucikari'",0,0,0,0,0,0,0,0,0
2544,7820,USER USER Dia nyinyir biar di ajak gabung ama Presiden kale',1,0,1,0,0,0,0,0,1
2545,2597,"Keputusan ERKA hari ini harus kita HORMATI, begitupun sebaliknya KAMI tidak akan memilih partai pendukung PENISTA AGAMA.",1,0,0,1,1,0,0,0,0
2546,9790,Presiden Ajak Ulama Turut Menyejukkan Suasana Jelang Pilkada Serentak -,0,0,0,0,0,0,0,0,0
2547,380,USER edan aq yang masi newbie menangis saja liatnya yampun kartu R w aja masi dikit bat',0,1,0,0,0,0,0,0,0
2548,10736,USER USER USER USER USER USER USER USER USER USER USER USER USER USER USER USER USER USER USER USER USER,0,0,0,0,0,0,0,0,0
2549,4772,"Kalian boleh tanya padaku ""kapan rabi?"", tapi jangan tanya aku ""kapan, Rabi?""\nAku bukan Yahudi'",0,0,0,0,0,0,0,0,0
2550,10223,USER Edan didinya euy madep T.O.P',0,1,0,0,0,0,0,0,0
2551,10452,Bawaslu: Kolaka Tertinggi Pelanggaran ASN Dalam Pilkada,0,0,0,0,0,0,0,0,0
2552,6290,"Pngn ngatain akun2 yg bilang ""nyari yg seumuran, no om2"" itu, ""enakan sama om2, bego!""'",0,1,0,0,0,0,0,0,0
2553,11027,siapa yg menawari B Prabowo coba sebut klo tidak subut mungkin cuma hoax aja x,0,0,0,0,0,0,0,0,0
2554,5299,pembangunan ekonomi kreatif yang ditawarkan pasangan calon gubernur dan wakil gubernur nomor urut dua yakni Tb Hasanuddin dan Anton Charliyan #2untukjabar #jabarhasanah2aja #hasanah #selamatharikartini #beyondthebandungspirit #habisgelapterbitlahterang,0,0,0,0,0,0,0,0,0
2555,2369,Rihanna ternyata ngga diet\nlah u siapa kampang ngomongin kalori',1,1,1,0,0,0,0,0,1
2556,6382,RT USER: aku suka la marathon eps sebelum ni sbb alang2 tak buat pape. Si Azam ni mmg kena dgn watak. Dari cerita hati batu lg dia ni\xe2\x80\xa6',0,0,0,0,0,0,0,0,0
2557,13086,"Ketika cinta menyapa, mungkin akan membuat buta hati tuli telinga. Tapi logika harus tetap terjaga agar tak terluka karenanya.'",0,0,0,0,0,0,0,0,0
2558,3353,"USER Sebenernya cebong, eh berudu, seolah ter-fait accompli...anies nyapres atau tetap gubernur, hidup mrk tetap ga tenang. Nikmat bgt gw dah klo lg begini buat mainin cebong.'",1,1,0,1,0,0,0,0,1
2559,4017,Seorang Ahok konsisten dengan memberangkatkan saudara kita umat muslim yg kurang mampu bisa pergi umroh secara gratis.; ; Tapi dilain sisi ada banyak penipu yang pakai embel2 agama untuk mengubur harapan saudara kita umat muslim yang kurang mampu untuk dap,0,0,0,0,0,0,0,0,0
2560,6420,"Tidak ada jarak antara pak USER dengan alim ulama.; Yang terjadi adalah ada kelompok politik yang berusaha menciptakan kesan atau citra Presiden berjarak dg ulama. ; ; Fakta , Insya Allah, menang melawan fiksi.",0,0,0,0,0,0,0,0,0
2561,8259,USER USER USER USER USER USER USER USER USER USER USER USER cebong dongo.. \xf0\x9f\x98\x82\xf0\x9f\x98\x82\xf0\x9f\x98\x82',1,1,0,1,0,0,0,0,1
2562,3668,USER banyak cocot',1,1,1,0,0,0,0,0,1
2563,468,Gua daiping mampus lu junedi',1,1,1,0,0,0,0,0,1
2564,11749,PKI itu Ilusi Ancaman Nyata bagi NKRI adalah USER dan antek antek Neo Orba Plus FPI FUI dan kelompok khilafah pemuja ISIS. Waspada!,1,0,0,1,1,1,0,0,0
2565,3129,USER Masalah dia i penulis ucapan kad raya cina tu??? ellooo???',1,1,1,0,0,1,0,0,0
2566,7957,"USER USER Berimajinasi sendiri \xf0\x9f\x98\x82\xf0\x9f\x98\x82\xf0\x9f\x98\x82\n\nMarie Elka Pangestu, Kwik Kian Gie, Rudy Hartono, Susi Susanti, Irwan Hidayat Bos Sidomuncul, Jaya Suprana dan ratusan tokoh tionghoa lain adalah orang baik,",0,0,0,0,0,0,0,0,0
2567,2921,"kalo mau Indonesia ini kembali damai, usir cina dari Indonesia.",1,0,0,1,0,1,0,0,0
2568,4278,almost two hours pki earphone but tak buka lagu or dgr apa apa pun lol',0,0,0,0,0,0,0,0,0
2569,3312,"USER Islam itu ideologi. Negara yg mengembannya wajib menyebarkannya dg dakwah &amp; jihad. Sama seperti AS nyebarkan demokrasi &amp; USSR nyebarkan komunis, karang dg jalan damai kadang dg perang. Dlm syariah itu ada hukum 'usyriyah &amp; kharajiyah.",0,0,0,0,0,0,0,0,0
2570,11532,iori berapa kali poto merem meluluk.. itu gak sengaja merem gegara pas ngedip atau emang sipit maximal ya?! wkwkkw.. monmaap dek iori XD',0,0,0,0,0,0,0,0,0
2571,3624,Aseng lah ni forever young. Aku dengar ulang ulang sial dgn music video sekali',0,0,0,0,0,0,0,0,0
2572,4855,"Memang anak-anak Regina Ant (RA) ini cerdas-cerdas..\nSanking cerdasnya banyak yang menelan sistem mentah-mentah.. \nSehingga banyak yang salah menjalankan, karena salah penafsiran... \xf0\x9f\x98\x85\n# Regina Ant\n# oh.. anak, cucu, cicit, cocot saya rupanya mereka.. \xf0\x9f\x98\x82 ups.. \xf0\x9f\x99\x8a\xf0\x9f\x99\x8a'",0,1,0,0,0,0,0,0,0
2573,11421,USER USER Waspada disemua lini sudah banyak penyusup kader pki n antek china komunis,1,0,0,1,0,1,0,0,0
2574,2260,"[Fakta Ve]Ve dulu punya anjing, namanya juno dan bruno. Tapi sekarang karena udah besar, jadi anjingnya dipindahin ke rumah kakeknya.'",0,0,0,0,0,0,0,0,0
2575,252,Para Pendukung Capres gagal Move On salalu sibuk Urus Aseng bawa kabur uang Rp 35 T. Tapi ngak sadar kenapa Aseng bisa kabur bawa uang sebanyak itu tanpa didukung Pribumi ASU. Mustahil Aseng bisa. Pribumi hanya diam kalau disogok. Mental kacung emang. URL,1,1,0,1,0,1,0,0,0
2576,1097,"USER kamu gak salah. Masa mau belajar hal baru atau mau melihat sesuatu dari kacamata lain melalui tvshow ini salah? Nggak, kamu udh baik adanya. Lanjutin aja apa yg kamu lakukan itu positif bgt utk diri kamu. Mereka mah emg udh pada dasarnya tolol dan gamau berkembang jadi",1,1,0,1,0,0,0,0,1
2577,12673,"Anda DIBODOHI & DIPERBUDAK Islam, Muhammad MATI diracun USER USER USER USER badannya bau",1,1,0,1,1,0,0,0,0
2578,6279,USER Contoilah demokrat\nJangankan cuma separtai\nBesanpun dipidanakan\nPdip isinya bajingan semua',1,1,0,1,0,0,0,0,1
2579,1747,USER Jempolnya kelebihan bacot',0,1,0,0,0,0,0,0,0
2580,6919,USER Cuma sejam anjir wk',0,1,0,0,0,0,0,0,0
2581,8335,lengserkan jokowi. buktikanlah bahwa kalian cinta jamban. wkwkwkwk,1,1,1,0,0,0,0,0,1
2582,12870,Saya tau abang juga memuja &amp; memuji pak SBY saat menjadi Presiden &amp; skrg berganti ke pak jokowi bagi saya hal itu wajar2 saja tapi jangan sampai kebablasan ya Abangku Sayang.\xf0\x9f\x98\x81',0,0,0,0,0,0,0,0,0
2583,4145,Pengadilan Agama Taliwang Eksekusi â??Harta Warisanâ?? di Bank BNI,0,0,0,0,0,0,0,0,0
2584,6756,RT USER Mending loe beritain mentri joko atau jokowi nya yg mundur krn gagal hadirkan pemerintah yg berkualitas minimal ber IQ,1,0,1,0,0,0,0,0,1
2585,9658,Antena lu panjang juga hut gw akui mulai jilat prabowo karena tau jokowi bakal keok di 2019 URL,1,0,1,0,0,0,0,0,1
2586,11199,Cina bukit ajak membawang yall \xf0\x9f\x98\x82',0,0,0,0,0,0,0,0,0
2587,3035,si goblok nyuruh ngupas kulit kacang ijo ber baskom baskom tolol bgt tai dikira gampang asu. GABUT BGT IDUPNYA MONYET GAK BALIK BALIK GUE',1,1,1,0,0,0,0,0,1
2588,12142,"Kalau lo gak tau apa-apa ya jangan berkoar sembarangan dong, keliatan banget kalau lo itu beneran bego :)) #FuckYou",1,1,1,0,0,0,0,0,1
2589,6028,"USER Aku pernah kak. Beli barang dari cina di shopee. Trus ada yg ga ada di paket. Aku tanyain kan. Sellernya mau ngerefund. Akhirnya di refund. Tapi kan akunya rugi di ongkos kirim. Apalagi ini barang jualan, masing2 harga jual udah digabung sa",0,0,0,0,0,0,0,0,0
2590,10102,USER yakali juga sih bolot amat aing',0,1,0,0,0,0,0,0,0
2591,9412,_kepada smua pejabat yg beragama kristen dimanapun anda berada. JADILAH GARAM DAN TERANG.#JGNKORUPSI.',0,0,0,0,0,0,0,0,0
2592,3397,"USER USER Cara berpikir bayi tabung perpaduan sperma KAMPRET dan ONTA.., jangan pernah diragukan lagi.'",1,1,1,0,0,0,0,0,1
2593,6791,USER USER USER USER USER USER USER USER USER USER USER USER USER USER USER USER Hrs dwaspadai atas nama ham tpi berujung k,0,0,0,0,0,0,0,0,0
2594,4353,USER harusnya kakek yang mpok mpok in cucu nete.',0,1,0,0,0,0,0,0,0
2595,12218,Tahukah anda siapa yang memakai baju abu2. Dia adalah Duta Besar Kuwait sekaligus Sekretaris Umum (BNPTKI) Tatang B Razak. Hari ini datang ke USER berdiskusi cukup banyak bagaimana seharusnya mengurus TKI. USER USER USER,0,0,0,0,0,0,0,0,0
2596,11189,RT USER USER Hrsnya kita malu di Indonesia baru ada gubenur cina,1,0,1,0,0,1,0,0,0
2597,10895,USER Hahaha. Kenapa bisa tidak asing? Kamu sudah pernah melihatku sebelumnya hm?',0,0,0,0,0,0,0,0,0
2598,9526,"Presiden disebutkan akan meninjau acara yang diadakan oleh Ditjen Bea Cukai, bertema â??Silaturahmi Presiden RI dengan Pengguna Fasilitas Kepabeanan dan Peluncuran Perizinan Online,â?? pada Selasa 27 Maret 2018.",0,0,0,0,0,0,0,0,0
2599,308,"PKS ultah di Balai Kota, RR ngomong nyapres di Balai Kota. Ganti aja namanya jd â??Balai Politikâ??. ð?¤ª",0,0,0,0,0,0,0,0,0
2600,10042,USER Cebong maennya gak pernah keluar dr kolam pak...makanya gak tau....udah jgn di tanggepin...ntar cebong laen pd nongol dr dasar kolam buteknya..',1,1,0,1,0,0,0,0,1
2601,3364,USER USER USER Sontoloyo dan sok paling bener... mungkin dia iparan sama allah swt \xf0\x9f\x98\x82\xf0\x9f\x98\x82\xf0\x9f\x98\x82',1,1,1,0,1,0,0,0,0
2602,7683,Di gelas kopi terakhir\nbarulah ia temukan kekasihnya.\nTerserak di ampas paling hitam\nyang pernah diciptakan Tuhan.\n~ URL,0,0,0,0,0,0,0,0,0
2603,9393,Wajar jika USER n kivlan zein benci dgn PKI. Wajar jg PKI benci dgn mrk jg para simpatisannya. daruratPKI URL,1,0,0,1,0,1,0,0,0
2604,10305,USER Bubarkan KPK! Busuk,1,1,0,1,0,0,0,0,1
2605,3175,"10 tahun SBY ga berani nutup Alexis; 3,5 tahun jokowi ga berani nutup Alexis; ; harus Gubernur indonesia juga yg turun tangan..; Pilihan Prabowo , mantap...",0,0,0,0,0,0,0,0,0
2606,7178,"USER ini aku bicarain sma swasta katolik krn sekolahku dulu gini\n(-) spp mahal, daftar ulang setiap naik kelas dan harus bayar lagi\n\n(+) disiplin, guru niat ngajar, bersih pake banget, fasilitas oke banget, kantin/kafe susananya enak'",0,0,0,0,0,0,0,0,0
2607,10877,USER lebih baik pilih ahok drpd pilih yg se iman tp koruptor dn munafik !! Bodoh kau,1,1,1,0,0,0,0,0,1
2608,1056,"RT USER: hati-hati kalian orang-orang dan kader GUSDUR yg pribumi antek CINA yg dipasang di rezim ini Lagi sedang ""ngepret"" saat ini.",1,0,0,1,0,1,0,0,0
2609,5498,USER USER USER USER Hah kok rezim ini aneh? Yang perintahkan jokowi mesti?,1,0,1,0,0,0,0,0,1
2610,7032,"USER USER USER USER Duhhh banci medsos muridnya napi 2 kali di bui ini ya, rumpi Bgtxx kayak junjungannya.. jelas jelas itu elo cong.. jd bencong mbok ya beradab dikit jangan kayak residivis gitu. Mentang2 punya guru mantan residivis 2 kali di b",1,1,1,0,0,0,0,1,0
2611,1556,USER Wong edan :(',1,1,1,0,0,0,1,0,0
2612,2042,USER Sudah ikut dibully berapa warga aseng non pasuruan saudara kocu?',1,0,0,1,0,0,0,0,1
2613,5199,"Kalau rakyat Jawa Barat menginginkan perubahan mendasar untuk pembangunan Jawa barat yanag signifikan, maka tidak ada pilihan selain memilih Gubernur yang selaras dengan Program2 Presiden Jokowi :); #HASANAH2Menang",0,0,0,0,0,0,0,0,0
2614,1216,sesembak depan camp jual zuzu zapi murni.\nmaw itu zuzu zapi or kambink or quda or onta or zebra murni\npasti sy tutup idung pas minumnya he',0,0,0,0,0,0,0,0,0
2615,8621,USER USER Wuih... cebong ngamuk\nKeluar deh di kolam butek\xf0\x9f\x98\x82\xf0\x9f\x98\x82\xf0\x9f\x98\x82',1,1,1,0,0,0,0,0,1
2616,10437,USER Udik lu',1,1,1,0,0,0,0,0,1
2617,3402,"USER USER Aww good luck, aku suka pusing kalau bahas budaya populer :')",0,0,0,0,0,0,0,0,0
2618,502,USER USER Maaf sebenarnya twiter pertama kali dbuat bukan buat orang bego',0,1,0,0,0,0,0,0,0
2619,5346,"Warga Baduy setelah selesai memperingati tradisi Seba di Pendopo Pemkab Lebak akan dilanjutkan kembali bertemu dengan Gubernur Banten Wahidin Halim hari ini, Sabtu (21/4) #SebaBaduy2018; ; Nh",0,0,0,0,0,0,0,0,0
2620,1263,"USER Aku nyanyiin. Nanti aku nyanyi lingsir wengi buat kamu ya, Iyo the Kunti.'",0,0,0,0,0,0,0,0,0
2621,9234,RT USER: di doublefuck dua kontol besar URL,0,1,0,0,0,0,0,0,0
2622,1262,"Saat ada tokoh yang bilang umat Muslim di negeri ini tertekan, sebagai Muslim saya melihat justru umat agama lain lebih tertekan.; ; Jumlah paling besar justru bikin kita makin egois, merasa punya hak lebih besar dibandingkan penganut agama lain.",0,0,0,0,0,0,0,0,0
2623,11510,"USER Krn cebong tdk akn mengakui pria lajang yg hanya lulusan SI Sastra sbg profesor, krn utk disebut profesor, ank SMP pun tau hrs melalui strata pnddikan lg stlh SI,itu jwb an knp cebong lbh cerdas dari bani kamfret'",1,1,0,1,0,0,0,0,1
2624,2125,RT USER: Akun kecebong yang ada kebanyakan dikelola etnis tertentu. Gaya pengecut cebong Jakarta. Mereka dendam dgn anies-sandi.,1,1,1,0,0,0,0,0,1
2625,3006,USER USER Kampret mencret pun kau salahkan pemerintah kok neeekkk',1,1,1,0,0,0,0,0,1
2626,38,USER USER Presiden RI Jokowi luarBiasa kerja nya tulus IHLAs untuk #RakyatB3rsamaJKW,0,0,0,0,0,0,0,0,0
2627,1193,"USER Lu punya gue, punya dower, punya rapper, punya onta, lu milik semua tapi cukup gue yang punya hati elu'",0,0,0,0,0,0,0,0,0
2628,620,USER Terus??\nAlus nya di puji. Butut nya disebut butut. Goblog disebut goblog.',0,1,0,0,0,0,0,0,0
2629,3221,USER Bangke \xf0\x9f\x98\x82\xf0\x9f\x98\x82\xf0\x9f\x98\x82',1,1,1,0,0,0,0,0,1
2630,4726,Sebagian besar dari kelompok yg saat ini anti USER dulunya memusuhi Gus Dur... takfiri dan sok arabi,1,0,0,1,0,0,0,0,1
2631,9702,RT USER: Jangan Lupa USER Adalah Pendukung Penista Agama (ahok) URL,1,0,0,1,1,0,0,0,0
2632,206,USER USER USER Segitu gentarnya dia takut terhadap Kafir...\xf0\x9f\x98\x81',0,0,0,0,0,0,0,0,0
2633,9245,"Jual beli tanpa ada ijab dan qabul yang biasa kita buat tu disebut jual beli al-Mu'athoh. Disisi Mazhab Syafie tak sah sebenarnya. Tapi ada beberapa ulama Mazhab Syafie seperti al-Nawawi, al-Baghawi etc kata sah. Pandangan mereka inilah yang dipakai sekara",0,0,0,0,0,0,0,0,0
2634,9466,Apa dampak dari lengsernya rezim adalah restar ekonomi dan akan banyak yang bangkrut dari kalangan mereka. Dan ekonomi akan di rubah menjadi system ekonomi syariah kemungkinan 1 tahun setelah lengser dan ekonomi...,0,0,0,0,0,0,0,0,0
2635,6810,Kangen smasa. Bajingan :(',0,1,0,0,0,0,0,0,0
2636,7132,Bangsad salah. Gilak.',0,1,0,0,0,0,0,0,0
2637,1459,"Menuju 2019 kiprah seorang Susi Pudjiastuti dipertanyakan. Akankah tetap menjadi menteri perikanan, kembali menjadi pengusaha, ataukah melangkah jauh menuju kursi wakil presiden? Q&amp;A â??Bukan Lautan, Hanya Kolam Susiâ?? Rabu (18/4) pukul 19.30 WIB di USER",0,0,0,0,0,0,0,0,0
2638,8872,Kadangkadang jadi munafik itu perlu lho yaa',0,0,0,0,0,0,0,0,0
2639,4274,"USER USER USER kyak dah lahir aja ngomong soeharto; l; KEAHLIAN CEBONG HANYA 1, TUKANG TIPU !!!; cebong mah gitu, goblok nggak ketulungan. Plonga plongo mengakibatkan optimisme berlebihan; ; #2019GantiPresiden #PlongaPlongo #Dunn",1,1,0,1,0,0,0,0,1
2640,4749,"Kau tahu kenapa kebanyakan orang menganggap kecantikan seorang wanita lebih penting di banding perangai yang baik? Karena di dunia ini, lelaki bodoh lebih banyak jumlahnya di banding lelaki buta. *nasihat orang tua dulu'",0,0,0,0,0,0,0,0,0
2641,2942,USER mampus lu ganti.',1,1,1,0,0,0,0,0,1
2642,9914,Alfaatihah..,0,0,0,0,0,0,0,0,0
2643,2494,"USER Itu Yg mencaci ulama siapa mmg nya klo bkn org kafir dan munafik,,,,pake otak mu pekok'",1,1,1,0,0,0,0,0,1
2644,4503,"Doa saya di Hijr Ismail : ; 1) beri hidayah org2 yg berlindung dlm bungkus islam tapi musuh islam, ; 2) beri kami kesabaran demi utuhnya NKRI, ; 3) bimbing kami wujudkan islam rahmatan lil alamin, ; 4) lindungi Bangsa dan Negara kami; 5) beri kami pemimpin",0,0,0,0,0,0,0,0,0
2645,11719,Banci lu ga berani bales lagi dasar penakut USER bruakakakak :D',1,1,1,0,0,0,0,1,0
2646,499,Wuakkakaa.. mampuss!! ga salah gue diblock dia sejak jaman Jokowi Ahok nyagub. Gaya lo toong.. toong.. Anies sandi URL,1,0,1,0,0,0,0,0,1
2647,7628,Prabowo: Jadi Kuli Saja Indonesia Kalah Saing URL,1,0,1,0,0,0,0,0,1
2648,7440,"Itu adalah ungkapan sayang, seperti kata #sinting punya USER URL",0,0,0,0,0,0,0,0,0
2649,11318,"USER USER USER Ga usah sok ngomong ekonomi dah; Kl bos kalian aja masih nunggak gaji karyawan, buat ngangkut kader ketempat acara ga mampu bayar carteran angkot, si USER bayar listrik pun nunggak; Beresin dulu ekonomi kalian; Ekonom",0,0,0,0,0,0,0,0,0
2650,9158,USER Namanya titit. Kalo itu tutut',0,1,0,0,0,0,0,0,0
2651,7342,(((ikeafurniture stan))))\n\nngakak bgt tae',0,1,0,0,0,0,0,0,0
2652,190,"Becak Warga Binjai Hendak Disita karena Gunakan Tenda Bertuliskan #2019GantiPresiden, PKS MERADANG; ; Bukti pemerintah panik dan takut?; ;",1,0,0,1,0,0,0,0,1
2653,8668,USER Orang gila',1,1,1,0,0,0,1,0,0
2654,11206,"Band metal maen di acara akustik emang pintar sih. Yang penting manggung terus. Tetap produktif. berak sehelm, cebok segelas'",0,1,0,0,0,0,0,0,0
2655,1370,USER Karna si nganu jg sampe skg agamanya msh diragukan tp kalo menurutku sih dia Kapir jg',1,1,1,0,1,0,0,0,0
2656,7466,USER Memang salah satu turunan nya juga cebong kampret definisinya komplotan penyebar hoax yg koar koar sambil mencret',1,1,0,1,0,0,0,0,1
2657,753,USER USER Indonesia sedang di jajah cina...,1,0,0,1,0,1,0,0,0
2658,10150,"mager padahal mantul banget anjir gsnya ada naif, ari lasso, padi, jaz, ran, fourtwnty, hivi, danilla. \xf0\x9f\x98\xa5 ))'",0,1,0,0,0,0,0,0,0
2659,3395,"USER USER Cebong kurang kopi eta mah...\xf0\x9f\x98\x81\nHarga harga naik, ngakunya masih bisa beli.. padahal mah ngutang \xf0\x9f\x98\x82'",1,1,0,1,0,0,0,0,1
2660,1790,"Vivo V9 Grand Launch! Disiarkan langsung dari Candi Borobudur dan 12 stasiun TV nasional, jadilah saksi perpaduan sempurna antara teknologi mutakhir, budaya, dan fashion pada 29 maret 2018 jam 8 malam. USER #VivoV9 #Vivo #VivoV9GrandLaunch",0,0,0,0,0,0,0,0,0
2661,3660,"USER Iya, beliau warga Katolik di sana. Cek DM nggih.'",0,0,0,0,0,0,0,0,0
2662,3155,USER ganti aja ama prabowo.. kelasnya cuman dubes,1,0,1,0,0,0,0,0,1
2663,11156,"Jadi gini rasanya setelah pergi, saling asing terus bertemu kembali, lebih seru wkwkwk'",0,0,0,0,0,0,0,0,0
2664,3004,yang belum tidur cepetan tidur nanti digigit onta hloo :D',0,0,0,0,0,0,0,0,0
2665,5504,Alasan nolak perpu: 1. Menunjukkan watak otoriter pemerintahan Jokowi 2. Memberangus kebebasan berekspresi 3. Bertentagan dgn nilai-nilai demokrasi,1,0,1,0,0,0,0,0,1
2666,10413,Rezim Diktaktor.. Ekonomi hanya utk Cina.. di sumpah setia UUD PENGKHIANAT USER Turunkan Jokowi,1,0,1,0,0,1,0,0,0
2667,11029,pak USER berfoto ramah bareng para haters ; ; ð???ð???ð???; ; #KamiGanjarYasin,0,0,0,0,0,0,0,0,0
2668,6200,RT USER: USER Diajak dialog menolak.. ada apa? Wajar bila rakyat menuduh kalian antek komunis,1,0,0,1,0,0,0,0,1
2669,5448,USER Wow. Gila sih bangsat banget calon suami lu ninggalin cuma gara-gara itu? Padahal kalo bener serius sampe nikah sih ya nanti dia juga dapet lah haha. Bersyukur lu dijauhin dari dia. Lo ga pantes dapet laki-laki bejat kaya gitu.',1,1,1,0,0,0,0,0,1
2670,2100,Yai Ma'ruf Amin salah seorang Ulama yg hadir maulid Majelis Rasulullah sejak pertama kali diadakan di Monas...; .; .; AlHabib Munzir AlMusawa menjuluki Yai Ma'ruf sbg Gerahamnya Ahlusunnah Wal Jama'ah,0,0,0,0,0,0,0,0,0
2671,12759,USER Pak USER saya harap mulai hari ini Anda tak lagi mengucapkan salam selain dalam Bahasa Indonesia,1,0,0,1,1,0,0,0,0
2672,10927,"USER USER Soalnya dia budek kaya bolot Om... \nTuuh, kuping nya kotor seperti hatinya....'",1,1,1,0,0,0,1,0,0
2673,226,USER USER USER USER Cebong kacung itu kt temen gw dungunya sampe ke tulang sum2..jd jgn buang2 energi debat sm mereka..\xf0\x9f\x98\x82',1,1,0,1,0,0,0,0,1
2674,12733,"USER USER USER bukti apa? pertumbuhan ekonomi stagan di 5% jaman SBY 6%, sdah hampir 5 tahun proyek joko hasil ngutang ke cina baru selesai 35 proyek dari 250 proyek, proyek infrastruktur pemda yang otonomi daerah di klaim prestasi",0,0,0,0,0,0,0,0,0
2675,9042,Jika isu 5000 pucuk senjata BENAR maka saya sarankan pak USER pecat tito,1,0,1,0,0,0,0,0,1
2676,11628,USER Btw ini radha bajingan ga sih wqwq dat muah2nya wqwqwq URL,0,1,0,0,0,0,0,0,0
2677,2694,murka anjir lagi maen hp malah mati',0,1,0,0,0,0,0,0,0
2678,2849,Sore Gaesð???; Dengan sentuhan Jokowi; Indonesia membangun Riauð???; Proyek Jln Tol Pekanbaru-Dumai ; salah 1 ruas Trans Sumatera; Jalan Tol sepanjang 131 km tsb bakal rampung di thn 2019.; Yuk kita lihat apa saja manfaat dan pandangan dari segi Ekonomi dari pem,0,0,0,0,0,0,0,0,0
2679,11853,"Survei: Khawatir Resesi Ekonomi, Konsumen Rajin Menabung",0,0,0,0,0,0,0,0,0
2680,8038,"USER Sok inggris lu anjir, ngerepotin lagi \xf0\x9f\x98\x92\xf0\x9f\x98\x92\nFi nya gabisa diceritain, panjaaangg sekali. Intinya lu cuek cuek najis di awal tapi ternyata isinya zonk pipel. Desc nya apa ya, lu itu orang tak berekspresi, gak bisa ditebak, nyebelin, tukan",1,1,1,0,0,0,0,0,1
2681,12331,USER Kata Cebong Dolar naik ga ngaruh....MATAMU PICEK #gantipresiden2019',1,1,1,0,0,0,1,0,0
2682,6616,USER HAHAHAHA MAMPUS\n\nselamat bergalau ria',1,1,1,0,0,0,0,0,1
